"id","score","title","summary","venue","year","authors","citationCount","referenceCount","influentialCitationCount","url"
"a0568d0bf4cbfcb5a17a20c576dfc421c4ccfb7c",11,"Incorporating Context into Subword Vocabularies","SaGe, a tokenizer that tailors subwords for their downstream use by baking in the contextualized signal at the vocabulary creation phase, is presented, showing its robustness to language properties such as morphological exponence and agglutination.","Conference of the European Chapter of the Association for Computational Linguistics",2022,"Shaked Yehezkel,Yuval Pinter",2,47,0,"https://www.semanticscholar.org/paper/a0568d0bf4cbfcb5a17a20c576dfc421c4ccfb7c"
"23f4b6432b74e5db05da04e354341807f5044f7e",10,"Language Modelling with Pixels","PIXEL is a pretrained language model that renders text as images, making it possible to transfer representations across languages based on orthographic similarity or the co-activation of pixels, and is more robust than BERT to orthographic attacks and linguistic code-switching, further confirming the benefits of modelling language with pixels.","International Conference on Learning Representations",2022,"Phillip Rust,Jonas F. Lotz,Emanuele Bugliarello,Elizabeth Salesky,Miryam de Lhoneux,Desmond Elliott",17,135,2,"https://www.semanticscholar.org/paper/23f4b6432b74e5db05da04e354341807f5044f7e"
"67c28d697460b684a0ba97d989719b4ed3c9cffc",6,"Elementwise Language Representation","Using this novel approach, the standard transformer architecture can be reused for all levels of language representations and be able to process much longer sequences at the same time-complexity without""any""architectural modification and additional overhead.","arXiv.org",2023,"Du-Yeong Kim,Jeeeun Kim",0,57,0,"https://www.semanticscholar.org/paper/67c28d697460b684a0ba97d989719b4ed3c9cffc"
"ec8f75e22ffbb5ad7e2f9cfc20a7780eed45715b",5,"CLIPPO: Image-and-Language Understanding from Pixels Only","The fact that CLIPPO does not require a tokenizer is exploited to show that it can achieve strong performance on multilingual multimodal retrieval without modifications, and it can obtain good accuracy in visual question answering, simply by rendering the question and image together.","",2022,"M. Tschannen,Basil Mustafa,N. Houlsby",3,84,0,"https://www.semanticscholar.org/paper/ec8f75e22ffbb5ad7e2f9cfc20a7780eed45715b"
"0290943797ce77535c7b448dc86f4f97d344332e",5,"Language Model Tokenizers Introduce Unfairness Between Languages","It is shown how disparity in the treatment of different languages arises at the tokenization stage, well before a model is even invoked, and the case is made that future language models should be trained using multilingually fair tokenizers.","arXiv.org",2023,"Aleksandar Petrov,Emanuele La Malfa,Philip H. S. Torr,Adel Bibi",0,101,0,"https://www.semanticscholar.org/paper/0290943797ce77535c7b448dc86f4f97d344332e"
"96713d3a63f18ce13ded2a3c5569d3eeba161c49",5,"CompoundPiece: Evaluating and Improving Decompounding Performance of Language Models","This work systematically study decompounding, the task of splitting compound words into their constituents, at a wide scale and uses self-supervised models to leverage decompounding during the creation of a subword tokenizer, which it refers to as CompoundPiece.","arXiv.org",2023,"Benjamin Minixhofer,Jonas Pfeiffer,Ivan Vulic",0,54,0,"https://www.semanticscholar.org/paper/96713d3a63f18ce13ded2a3c5569d3eeba161c49"
"6237a49297f45ebfdeabbbf67d06de323d1fccd4",5,"Pixel Representations for Multilingual Translation and Data-efficient Cross-lingual Transfer","It is observed that various properties of pixel representations not only enable seamless cross-lingual transfer to unseen scripts, but make pixel representations more data-efficient than alternatives such as vocabulary expansion.","arXiv.org",2023,"Elizabeth Salesky,Neha Verma,Philipp Koehn,Matt Post",0,40,0,"https://www.semanticscholar.org/paper/6237a49297f45ebfdeabbbf67d06de323d1fccd4"
"17fbffb05fa14e21d1c506fd5f0f568b955fe983",5,"Do All Languages Cost the Same? Tokenization in the Era of Commercial Language Models","This work conducts a systematic analysis of the cost and utility of OpenAI's language model API on multilingual benchmarks in 22 typologically diverse languages and shows evidence that speakers of a large number of the supported languages are overcharged while obtaining poorer results.","arXiv.org",2023,"Orevaoghene Ahia,Sachin Kumar,Hila Gonen,Jungo Kasai,David R. Mortensen,Noah A. Smith,Yulia Tsvetkov",0,72,0,"https://www.semanticscholar.org/paper/17fbffb05fa14e21d1c506fd5f0f568b955fe983"
"f8ef90a8cac1a8edf9477688aac24864c547d6cd",5,"Character-Aware Models Improve Visual Text Rendering","This paper trains a suite of image generation models, and shows that character-aware variants outperform their character-blind counterparts across a range of novel text rendering tasks (the authors' DrawText benchmark), and sets a much higher state-of-the-art on visual spelling.","Annual Meeting of the Association for Computational Linguistics",2022,"Rosanne Liu,Daniel H Garrette,Chitwan Saharia,William Chan,Adam Roberts,Sharan Narang,Irina Blok,R. Mical,Mohammad Norouzi,Noah Constant",15,41,6,"https://www.semanticscholar.org/paper/f8ef90a8cac1a8edf9477688aac24864c547d6cd"
"035315281c72763a3e0956775732e64f5f193d82",4,"Natural Language Generation with Pixels","A conditional diffusion-based decoder for modeling rendered natural language that is capable of generating coherent, plausible natural language rendered as images and compared with strong transformer-based autoregressive baselines in both the unconditional and sequence-to-sequence setting.","",2023,"",0,44,0,"https://www.semanticscholar.org/paper/035315281c72763a3e0956775732e64f5f193d82"
"0232715f9089e3a2fc002cff6737bb9939805b8d",4,"Local Byte Fusion for Neural Machine Translation","A Local Byte Fusion (LOBEF) method for byte-based machine translation—utilizing byte n-gram and word boundaries—to aggregate local semantic information to perform competitive to subword models.","Annual Meeting of the Association for Computational Linguistics",2022,"Makesh Narsimhan Sreedhar,Xiangpeng Wan,Yu-Jie Cheng,Junjie Hu",0,45,0,"https://www.semanticscholar.org/paper/0232715f9089e3a2fc002cff6737bb9939805b8d"
"117a0c2c23a5a558cf3b39468d917a750bca720c",4,"Are Character-level Translations Worth the Wait? Comparing Character- and Subword-level Models for Machine Translation","This work performs an extensive comparison across multiple languages and experimental conditions of state-of-the-art character- and subword-level pre-trained models on NMT, showing the effectiveness of character-level modeling in translation, particularly in cases where training data is limited.","",2023,"Lukas Edman,Gabriele Sarti,Antonio Toral,Gertjan van Noord,Arianna Bisazza",1,31,0,"https://www.semanticscholar.org/paper/117a0c2c23a5a558cf3b39468d917a750bca720c"
"5b0c0d181f31acebf2442e7b7c7af27f3f6a5f4a",4,"Hints on the data for language modeling of synthetic languages with transformers","To what extent the critical amount of data varies for languages of different morphological typology, in particular those that have a rich inflectional morphology, and whether the tokenization method to preprocess the data can make a difference, is addressed.","Annual Meeting of the Association for Computational Linguistics",2023,"Rodolfo Zevallos,Núria Bel",0,39,0,"https://www.semanticscholar.org/paper/5b0c0d181f31acebf2442e7b7c7af27f3f6a5f4a"
"9ccad0208b50042d8378b77700146a98bd22ea3f",4,"The SIGMORPHON 2022 Shared Task on Morpheme Segmentation","","Special Interest Group on Computational Morphology and Phonology Workshop",2022,"Khuyagbaatar Batsuren,Gábor Bella,Aryaman Arora,Viktor Martinovi'c,Kyle Gorman,Zdenvek vZabokrtsk'y,A. Ganbold,vS'arka Dohnalov'a,Magda vSevvc'ikov'a,Katevrina Pelegrinov'a,Fausto Giunchiglia,Ryan Cotterell,Ekaterina Vylomova",9,81,0,"https://www.semanticscholar.org/paper/9ccad0208b50042d8378b77700146a98bd22ea3f"
"14efaa989b8db89ad907e6a15253d482cbba77d9",4,"Linguistically inspired roadmap for building biologically reliable protein language models","","Nature Machine Intelligence",2022,"Mai Ha Vu,R. Akbar,Philippe A. Robert,B. Swiatczak,G. K. Sandve,V. Greiff,Dag Trygve Tryslew Haug",2,134,0,"https://www.semanticscholar.org/paper/14efaa989b8db89ad907e6a15253d482cbba77d9"
"0f8f20ef4bc90a2b210bc5be08a7f326a214556f",4,"An Information Extraction Study: Take In Mind the Tokenization!","The main outcome is twofold: tokenization patterns can introduce inductive bias that results in state-of-the-art performance, and the character-based models produce promising results; thus, transitioning to token-free IE models is feasible.","arXiv.org",2023,"Christos Theodoropoulos,Marie-Francine Moens",1,38,0,"https://www.semanticscholar.org/paper/0f8f20ef4bc90a2b210bc5be08a7f326a214556f"
"d7a379254ac2dee2e31dfdeedb440176f0285aa5",4,"From Characters to Words: Hierarchical Pre-trained Language Model for Open-vocabulary Language Understanding","This work introduces a novel open-vocabulary language model that adopts a hierarchical two-level approach: one at the word level and another at the sequence level, and demonstrates that this hierarchical model is robust to textual corruption and domain shift.","Annual Meeting of the Association for Computational Linguistics",2023,"Li Sun,F. Luisier,K. Batmanghelich,D. Florêncio,Changrong Zhang",0,52,0,"https://www.semanticscholar.org/paper/d7a379254ac2dee2e31dfdeedb440176f0285aa5"
"e4d2ba4cb6f364079ce3731e86b860264677ae7d",3,"Downstream Task-Oriented Neural Tokenizer Optimization with Vocabulary Restriction as Post Processing","An example of the BiLSTM-based tokenizer with vocabulary restriction is proposed, which can capture wider contextual information for the tokenization process than non-neural-basedtokenization methods used in existing work.","arXiv.org",2023,"Tatsuya Hiraoka,Tomoya Iwakura",0,26,0,"https://www.semanticscholar.org/paper/e4d2ba4cb6f364079ce3731e86b860264677ae7d"
"e79d1206292bc5e67ba19737d87d4b2ea4a37105",3,"Charformer: Fast Character Transformers via Gradient-based Subword Tokenization","This paper introduces a soft gradient-based subword tokenization module (GBST) that automatically learns latent subword representations from characters in a data-driven fashion and paves the way for highly performant token-free models that are trained completely end-to-end.","International Conference on Learning Representations",2021,"Yi Tay,Vinh Q. Tran,Sebastian Ruder,Jai Gupta,Hyung Won Chung,Dara Bahri,Zhen Qin,Simon Baumgartner,Cong Yu,Donald Metzler",79,69,15,"https://www.semanticscholar.org/paper/e79d1206292bc5e67ba19737d87d4b2ea4a37105"
"c08c2fd7b269bd9d6c1162adc3b059cdf21d40a6",3,"Lifting the Curse of Multilinguality by Pre-training Modular Transformers","This work introduces language-specific modules of their Cross-lingual Modular models from the start, which allows them to grow the total capacity of the model, while keeping the total number of trainable parameters per language constant.","North American Chapter of the Association for Computational Linguistics",2022,"Jonas Pfeiffer,Naman Goyal,Xi Victoria Lin,Xian Li,James Cross,Sebastian Riedel,Mikel Artetxe",47,69,3,"https://www.semanticscholar.org/paper/c08c2fd7b269bd9d6c1162adc3b059cdf21d40a6"
"3e08d84af266026e7d254729f3afc6dcd572d264",3,"One does not fit all! On the Complementarity of Vision Encoders for Vision and Language Tasks","This work exhaustively experiments with three popular VEs on six downstream V+L tasks and suggests that diverse VEs complement each other, resulting in improved downstream V-L task performance, where the improvements are not due to simple ensemble effects.","arXiv.org",2022,"Gregor Geigle,Chen Cecilia Liu,Jonas Pfeiffer,Iryna Gurevych",0,42,0,"https://www.semanticscholar.org/paper/3e08d84af266026e7d254729f3afc6dcd572d264"
"69b8db33a7ea7366e48c465b6f35a8d7f8f1a3b5",3,"XLM-V: Overcoming the Vocabulary Bottleneck in Multilingual Masked Language Models","A new approach for scaling to very large multilingual vocabularies is introduced by de-emphasizing token sharing between languages with little lexical overlap and assigning vocabulary capacity to achieve sufficient coverage for each individual language.","arXiv.org",2023,"Davis Liang,Hila Gonen,Yuning Mao,Rui Hou,Naman Goyal,Marjan Ghazvininejad,Luke Zettlemoyer,Madian Khabsa",7,34,2,"https://www.semanticscholar.org/paper/69b8db33a7ea7366e48c465b6f35a8d7f8f1a3b5"
"5dee4ece8ec1725a7d071b74bf60f4f5fd2e78ad",3,"Sub-Character Tokenization for Chinese Pretrained Language Models","Experimental results show that SubChar tokenizers have two main advantages over existing tokenizers: 1) They can tokenize inputs into much shorter sequences, thus improving the computational efficiency, and 2) Pronunciation-based SubChartokenization can encode Chinese homophones into the same transliteration sequences and produce the same tokenization output, hence being robust to homophone typos.","Transactions of the Association for Computational Linguistics",2021,"Chenglei Si,Zhengyan Zhang,Yingfa Chen,Fanchao Qi,Xiaozhi Wang,Zhiyuan Liu,Yasheng Wang,Qun Liu,Maosong Sun",2,60,0,"https://www.semanticscholar.org/paper/5dee4ece8ec1725a7d071b74bf60f4f5fd2e78ad"
"0de580957d23dd65e31b6c95e6bc5d15bc15c57d",3,"Impact of Tokenization on Language Models: An Analysis for Turkish","This work compares five tokenizers at different granularity levels, that is, their outputs vary from the smallest pieces of characters to the surface form of words, and finds that increasing the vocabulary size improves the performance of Morphological- and Word-level tokenizers more than that of de facto tokenizers.","ACM Trans. Asian Low Resour. Lang. Inf. Process.",2022,"Cagri Toraman,E. Yilmaz,Furkan Şahinuç,Oguzhan Ozcelik",9,70,3,"https://www.semanticscholar.org/paper/0de580957d23dd65e31b6c95e6bc5d15bc15c57d"
"29a54c072bcf85fa6934b6f701962a7c9aeb6489",3,"Byte-Level Grammatical Error Correction Using Synthetic and Curated Corpora","It is shown that a byte-level model enables higher correction quality than a subword approach, not only for simple spelling errors, but also for more complex semantic, stylistic and grammatical issues.","Annual Meeting of the Association for Computational Linguistics",2023,"Svanhv'it Lilja Ing'olfsd'ottir,Pétur Orri Ragnarsson,H. Jónsson,Haukur Barri S'imonarson,Vilhjálmur Þorsteinsson,Vésteinn Snæbjarnarson",0,55,0,"https://www.semanticscholar.org/paper/29a54c072bcf85fa6934b6f701962a7c9aeb6489"
"3d3f8399d625238fddb366697acb73446129d65c",3,"Revisiting Pre-trained Language Models and their Evaluation for Arabic Natural Language Processing","This work addresses two major problems in existing Arabic PLMs that limit the progress of the Arabic NLU and NLG fields and releases three new Arabic BERT-style models, and achieves a new state-of-the-art performance on discriminative and generative ArabicNLU andNLG tasks.","Conference on Empirical Methods in Natural Language Processing",2022,"Abbas Ghaddar,Yimeng Wu,Sunyam Bagga,Ahmad Rashid,Khalil Bibi,Mehdi Rezagholizadeh,Chao Xing,Yasheng Wang,Xinyu Duan,Zhefeng Wang,Baoxing Huai,Xin Jiang,Qun Liu,P. Langlais",0,81,0,"https://www.semanticscholar.org/paper/3d3f8399d625238fddb366697acb73446129d65c"
"5079e188ae86d8330414edb65e898ed306ac450d",3,"Subword Segmental Machine Translation: Unifying Segmentation and Target Sentence Generation","SSMT unifies subword segmentation and MT in a single trainable model that learns to segment target sentence words while jointly learning to generate target sentences and proves more robust on a test set constructed for evaluating morphological compositional generalisation.","arXiv.org",2023,"Francois Meyer,Jan Buys",0,31,0,"https://www.semanticscholar.org/paper/5079e188ae86d8330414edb65e898ed306ac450d"
"36e1b3973c673d3c323014a168e05c5762f84262",3,"OneCAD: One Classifier for All image Datasets using multimodal learning","This work addresses the question: Is it possible to create a number-of-class-agnostic model architecture and proposes a training and inference framework OneCAD (One Classifier for All image Datasets) to achieve close-to number- of-class,agnostic transformer model.","arXiv.org",2023,"S. Wadekar,E. Culurciello",0,32,0,"https://www.semanticscholar.org/paper/36e1b3973c673d3c323014a168e05c5762f84262"
"491eaab2ff93772d52be8c014bf97466d8c6fe73",3,"Tokenization Tractability for Human and Machine Learning Model: An Annotation Study","A quantitative investigation result is provided that shows the tractable tokenizations for humans and machine learning models are not necessarily the same as each other.","arXiv.org",2023,"Tatsuya Hiraoka,Tomoya Iwakura",0,32,0,"https://www.semanticscholar.org/paper/491eaab2ff93772d52be8c014bf97466d8c6fe73"
"7cdebb73662387d9040da4f27a7dc04dbffa3c3e",3,"ByGPT5: End-to-End Style-conditioned Poetry Generation with Token-free Language Models","This work successfully pre-train ByGPT5, a new token-free decoder-only language model, and fine-tune it on a large custom corpus of English and German quatrains annotated with the authors' styles, and shows that ByG PT5 outperforms other models such as mT5, ByT4, GPT-2 and ChatGPT, while also being more parameter efficient and performing favorably compared to humans.","Annual Meeting of the Association for Computational Linguistics",2022,"Jonas Belouadi,Steffen Eger",4,69,0,"https://www.semanticscholar.org/paper/7cdebb73662387d9040da4f27a7dc04dbffa3c3e"
"8f248b5476666e700390f7f8ff6ca923f97d726c",3,"Advancing protein language models with linguistics: a roadmap for improved interpretability",,"arXiv.org",2022,"Mai Ha Vu,R. Akbar,Philippe A. Robert,B. Swiatczak,V. Greiff,G. K. Sandve,Dag Trygve Tryslew Haug",4,118,0,"https://www.semanticscholar.org/paper/8f248b5476666e700390f7f8ff6ca923f97d726c"
"ea8197cb357af6f89e8b6e5548897236a24719b1",3,"What is the best recipe for character-level encoder-only modelling?","This paper aims to benchmark recent progress in language understanding models that output contextualised representations at the character level, and finds that the best performing character-level model exceeds the performance of a token-based model trained with the same settings on the same data.","Annual Meeting of the Association for Computational Linguistics",2023,"Kris Cao",0,40,0,"https://www.semanticscholar.org/paper/ea8197cb357af6f89e8b6e5548897236a24719b1"
"5917ba80a905aeba41487f7dcdb8b885f18689f5",3,"Tokenization and the Noiseless Channel","It is proposed that good tokenizers lead to efficient channel usage, where the channel is the means by which some input is conveyed to the model and efficiency can be quantified in information-theoretic terms as the ratio of the Shannon entropy to the maximum entropy of the subword distribution.","Annual Meeting of the Association for Computational Linguistics",2023,"Vilém Zouhar,Clara Meister,Juan Luis Gastaldi,L. Du,Mrinmaya Sachan,Ryan Cotterell",0,43,0,"https://www.semanticscholar.org/paper/5917ba80a905aeba41487f7dcdb8b885f18689f5"
"ed7b51e4a5c4835218f6697b280afb2849211939",3,"Are Character-level Translations Worth the Wait? An Extensive Comparison of Character- and Subword-level Models for Machine Translation","An extensive comparison across multiple languages and experimental conditions of state-of-the-art character- and subword-level pre-trained models on NMT shows that the former not only are effective in translation, but frequently outperform subword models, particularly in cases where training data is limited.","arXiv.org",2023,"Lukas Edman,Antonio Toral,Gertjan van Noord",0,28,0,"https://www.semanticscholar.org/paper/ed7b51e4a5c4835218f6697b280afb2849211939"
"ca7636c1d3426dd09a185abf25f81f7a8fa594e1",3,"How do different tokenizers perform on downstream tasks in scriptio continua languages?: A case study in Japanese",,"Annual Meeting of the Association for Computational Linguistics",2023,"T. Fujii,Koki Shibata,Atsuki Yamaguchi,Terufumi Morishita,Yasuhiro Sogawa",0,38,0,"https://www.semanticscholar.org/paper/ca7636c1d3426dd09a185abf25f81f7a8fa594e1"
"77221764ce0eb68d29e1fc35ae61a21179e7dbe5",3,"What changes when you randomly choose BPE merge operations? Not much.","Two simple randomized variants of byte pair encoding are introduced and whether randomizing the selection of merge operations substantially affects a downstream machine translation task is explored, hypothesizing that this task may show sensitivity to the method of choosing subwords.","First Workshop on Insights from Negative Results in NLP",2023,"Jonne Saleva,Constantine Lignos",1,20,0,"https://www.semanticscholar.org/paper/77221764ce0eb68d29e1fc35ae61a21179e7dbe5"
"19e2f3a1e0c3b8340c14cb83e9ca6878a2598852",2,"IT5: Large-scale Text-to-text Pretraining for Italian Language Understanding and Generation","IT5 is introduced, the first family of encoder-decoder transformer models pretrained specifically on Italian, with the monolingual IT5 models consistently outperforming their multilingual counterparts and setting a new state-of-the-art for most Italian conditional language generation tasks.","arXiv.org",2022,"Gabriele Sarti,M. Nissim",12,40,2,"https://www.semanticscholar.org/paper/19e2f3a1e0c3b8340c14cb83e9ca6878a2598852"
"bd6f44bab6dbb5c93854f67f95f82274adc7d2d0",2,"MonoByte: A Pool of Monolingual Byte-level Language Models","Experiments on QA and NLI tasks show that monolingual models achieve competitive performance to the multilingual one, and hence can be served to strengthen the understanding of cross-lingual transferability in language models.","International Conference on Computational Linguistics",2022,"H. Abonizio,Leandro Rodrigues de Souza,R. Lotufo,Rodrigo Nogueira",0,45,0,"https://www.semanticscholar.org/paper/bd6f44bab6dbb5c93854f67f95f82274adc7d2d0"
"75214f960f82a0ed7fcf6fc0cd70b8d8f1847f8a",2,"Single Model Ensemble for Subword Regularized Models in Low-Resource Machine Translation","An inference strategy that approximates the marginalized likelihood by using multiple segmentations including the most plausible segmentation and several sampled segmentations that improves the performance of models trained with subword regularization in low-resource machine translation tasks.","Findings",2022,"Sho Takase,Tatsuya Hiraoka,Naoaki Okazaki",1,16,0,"https://www.semanticscholar.org/paper/75214f960f82a0ed7fcf6fc0cd70b8d8f1847f8a"
"380605105531d27474190451183bf6ad6126cac8",2,"GPoeT: a Language Model Trained for Rhyme Generation on Synthetic Data","A novel solution for learning to rhyme is proposed, based on synthetic data generated with a rule-based rhyming algorithm and an evaluation metric that uses a phonetic dictionary and the definitions of perfect and assonant rhymes.","LATECHCLFL",2023,"Andrei Popescu-Belis,Àlex R. Atrio,Bastien Bernath,Etienne Boisson,Teo Ferrari,Xavier Theimer-lienhard,Giorgos Vernikos",0,28,0,"https://www.semanticscholar.org/paper/380605105531d27474190451183bf6ad6126cac8"
"d725c41b8e0516d0cf84d8fbd25eb7fc01a47342",2,"A Primer on Pretrained Multilingual Language Models","A review of the existing literature covering the above broad areas of research pertaining toMultilingual Language Models and some promising directions of future research are recommended.","arXiv.org",2021,"Sumanth Doddapaneni,Gowtham Ramesh,Anoop Kunchukuttan,Pratyush Kumar,Mitesh M. Khapra",31,137,3,"https://www.semanticscholar.org/paper/d725c41b8e0516d0cf84d8fbd25eb7fc01a47342"
"61c7e5590064b250ebb5a53c430aede492a4d8ab",2,"BERT for Natural Language Processing in Bahasa Indonesia","The findings in this article can be used as ideas for developing NLP using the BERT model in Indonesian and the downstream task of the Indonesian BERT models are sentiment analysis, classification, and text summarization.","2022 2nd International Conference on Intelligent Cybernetics Technology & Applications (ICICyTA)",2022,"Danny Sebastian,H. Purnomo,I. Sembiring",0,65,0,"https://www.semanticscholar.org/paper/61c7e5590064b250ebb5a53c430aede492a4d8ab"
"3909f91811089dce1c12abd594d2638a4e77d961",2,"Sabi\'a: Portuguese Large Language Models","It is demonstrated that monolingual pretraining on the target language significantly improves models already extensively trained on diverse corpora, and that the majority of the benefits stem from the domain-specific knowledge acquired through monolingUAL pretraining.","",2023,"Ramon Pires,H. Abonizio,Thales Rog'erio,Rodrigo Nogueira",0,78,0,"https://www.semanticscholar.org/paper/3909f91811089dce1c12abd594d2638a4e77d961"
"d7e0f0cec28c34710fa631df410b717186741db5",2,"A Novel Sampling Scheme for Text- and Image-Conditional Image Synthesis in Quantized Latent Spaces","Despite its remarkable simplicity, the proposed streamlined approach for text-to-image generation yields aesthetically pleasing images with few sampling iterations, allows for intriguing ways for conditioning the model, and imparts advantages absent in state-of-the-art techniques.","",2022,"Dominic Rampas,Pablo Pernias,M. Aubreville",2,34,1,"https://www.semanticscholar.org/paper/d7e0f0cec28c34710fa631df410b717186741db5"
"1e4b6567ff66de6cdcbe58c863538241e2f62b45",2,"Aligning Text-to-Image Models using Human Feedback","A fine-tuning method for aligning text-to-image models using human feedback, comprising three stages, that generates objects with specified colors, counts and backgrounds more accurately than the pre-trained model.","arXiv.org",2023,"Kimin Lee,Hao Liu,M. Ryu,Olivia Watkins,Yuqing Du,Craig Boutilier,P. Abbeel,M. Ghavamzadeh,S. Gu",30,50,1,"https://www.semanticscholar.org/paper/1e4b6567ff66de6cdcbe58c863538241e2f62b45"
