"id","score","title","summary","venue","year","authors","citationCount","referenceCount","influentialCitationCount","url"
"445f82be81e37b064730285cf8de70edce80d6a5",1,"Wine is Not v i n. - On the Compatibility of Tokenizations Across Languages","It is shown that the compatibility measure proposed allows the system designer to create vocabularies across languages that are compatible – a desideratum that so far has been neglected in multilingual models.","Conference on Empirical Methods in Natural Language Processing",2021,"Antonis Maronikolakis,Philipp Dufter,Hinrich Schütze",6,32,2,"https://www.semanticscholar.org/paper/445f82be81e37b064730285cf8de70edce80d6a5"
"633780929ae262e461ea35c20b36a5d7042350e7",1,"MDAPT: Multilingual Domain Adaptive Pretraining in a Single Model","Evaluation on nine domain-specific datasets show that a single multilingual domain- specific model can outperform the general multilingual model, and performs close to its monolingual counterpart.","Conference on Empirical Methods in Natural Language Processing",2021,"Rasmus Jorgensen,Mareike Hartmann,Xiang Dai,Desmond Elliott",1,58,0,"https://www.semanticscholar.org/paper/633780929ae262e461ea35c20b36a5d7042350e7"
"6b2062812d2e353ea884a0cc077e9f6c73351423",1,"On Generalist and Domain-Specific Music Classification Models and Their Impacts on Brazilian Music Genre Recognition","It is empirically show that models trained on specific-domain data perform better than generalist models to classify music in the same domain, even trained with a smaller dataset.","Anais do XVIII Simpósio Brasileiro de Computação Musical (SBCM 2021)",2021,"Diego Furtado Silva,A. Silva,Luís Felipe Ortolan,R. Marcacini",0,49,0,"https://www.semanticscholar.org/paper/6b2062812d2e353ea884a0cc077e9f6c73351423"
"070759c65bd32df9f1f57ef52a4c49a77d3057d1",1,"To Augment or Not to Augment? A Comparative Study on Text Augmentation Techniques for Low-Resource NLP","Three categories of text augmentation methodologies which perform changes on the syntax, token and character levels are investigated, finding the experimented techniques to be effective on morphologically rich languages in general rather than analytic languages such as Vietnamese.","",2021,"Gozde Gul cSahin",4,70,0,"https://www.semanticscholar.org/paper/070759c65bd32df9f1f57ef52a4c49a77d3057d1"
"bd0e39d075553a68e7af6fdf437c2a890ad59a58",1,"Scene-Text Aware Image and Text Retrieval with Dual-Encoder","This work proposes pre-training methods that encourage a joint understanding of the scene-text and surrounding visual information and demonstrates that these methods improve the retrieval performances of the dual-encoder models.","Annual Meeting of the Association for Computational Linguistics",2022,"Shumpei Miyawaki,Taku Hasegawa,Kyosuke Nishida,Takuma Kato,Jun Suzuki",1,37,0,"https://www.semanticscholar.org/paper/bd0e39d075553a68e7af6fdf437c2a890ad59a58"
"d3f72c17404ba7f8e56d6d4d7fdf9d808f559570",1,"Fine-tuning de modèles de langues pour la veille épidémiologique multilingue avec peu de ressources (Fine-tuning Language Models for Low-resource Multilingual Epidemic Surveillance)","","JEPTALNRECITAL",2022,"Stephen Mutuvi,Emanuela Boros,A. Doucet,Adam Jatowt,G. Lejeune,Moses Odeo",0,29,0,"https://www.semanticscholar.org/paper/d3f72c17404ba7f8e56d6d4d7fdf9d808f559570"
"a4fc3d86b84f351e87bcdbe1376eae64750629ac",1,"Combating the Curse of Multilinguality in Cross-Lingual WSD by Aligning Sparse Contextualized Word Representations","This paper advocates for using large pre-trained monolingual language models in cross lingual zero-shot word sense disambiguation (WSD) coupled with a contextualized mapping mechanism and demonstrates the effectiveness of employing sparse contextualized word representations obtained via a dictionary learning procedure.","North American Chapter of the Association for Computational Linguistics",2022,"Gábor Berend",0,50,0,"https://www.semanticscholar.org/paper/a4fc3d86b84f351e87bcdbe1376eae64750629ac"
"f1edc02e4096acb8ea491b4b47c2cbdf0ff3ec91",1,"Writing System and Speaker Metadata for 2,800+ Language Varieties","An open-source dataset providing metadata for about 2,800 language varieties used in the world today, as well as an estimated speaker count for each variety, which is the largest publicly-available, machine-readable resource with writing system and speaker information for the world’s languages.","International Conference on Language Resources and Evaluation",2022,"D. Esch,Tamar Lucassen,Sebastian Ruder,Isaac Caswell,Clara Rivera",8,43,1,"https://www.semanticscholar.org/paper/f1edc02e4096acb8ea491b4b47c2cbdf0ff3ec91"
"ea786f376c51dba5c3be79eed6e4814e8afc9290",1,"Faster and Cheaper Energy Demand Forecasting at Scale","Transplit, a new lightweight transformer-based model, is introduced, which significantly decreases this cost by exploiting the seasonality property and learning typical days of power demand.","",2022,"",0,17,0,"https://www.semanticscholar.org/paper/ea786f376c51dba5c3be79eed6e4814e8afc9290"
"3885bdef44dbbcaae85a6b4ccaf279593daadb80",1,"Crossing the Conversational Chasm: A Primer on Natural Language Processing for Multilingual Task-Oriented Dialogue Systems","An extensive overview of existing methods and resources in multilingual ToD is provided as an entry point  to this exciting and emerging field and draws parallels between components of the ToD pipeline and other NLP tasks, which can inspire solutions for learning in low-resource scenarios.","Journal of Artificial Intelligence Research",2021,"E. Razumovskaia,Goran Glavavs,Olga Majewska,E. Ponti,A. Korhonen,Ivan Vulic",10,317,0,"https://www.semanticscholar.org/paper/3885bdef44dbbcaae85a6b4ccaf279593daadb80"
"9076b287843441fb749d37b69317162c1fa272e3",1,"XLM-T: Multilingual Language Models in Twitter for Sentiment Analysis and Beyond","XLM-T is introduced, a model to train and evaluate multilingual language models in Twitter with a new strong multilingual baseline consisting of an XLM-R model pre-trained on millions of tweets in over thirty languages, alongside starter code to subsequently fine-tune on a target task.","International Conference on Language Resources and Evaluation",2021,"Francesco Barbieri,Luis Espinosa Anke,José Camacho-Collados",20,43,4,"https://www.semanticscholar.org/paper/9076b287843441fb749d37b69317162c1fa272e3"
"21230f72afae4f19f59c4ce9c099075e7ecfe77c",1,"gaBERT — an Irish Language Model","This work introduces, gaBERT, a monolingual BERT model for the Irish language, and compares it to multilingual BERT and shows that gaberT provides better representations for a downstream parsing task.","International Conference on Language Resources and Evaluation",2021,"James Barry,Joachim Wagner,Lauren Cassidy,Alan Cowap,Teresa Lynn,Abigail Walsh,M'iche'al J. 'O Meachair,Jennifer Foster",4,55,1,"https://www.semanticscholar.org/paper/21230f72afae4f19f59c4ce9c099075e7ecfe77c"
"071440ccd1084d20d345fafd0bcaa5993f71fb04",1,"xGQA: Cross-Lingual Visual Question Answering","This work provides xGQA, a new multilingual evaluation benchmark for the visual question answering task, and extends the established English GQA dataset to 7 typologically diverse languages, enabling us to detect and explore crucial challenges in cross-lingualVisual question answering.","Findings",2021,"Jonas Pfeiffer,Gregor Geigle,Aishwarya Kamath,Jan-Martin O. Steitz,S. Roth,Ivan Vulic,Iryna Gurevych",16,81,3,"https://www.semanticscholar.org/paper/071440ccd1084d20d345fafd0bcaa5993f71fb04"
"ed4705fc97d35f8b02a4c11633cb6dd6bd316cc7",1,"Cross-lingual Transfer of Monolingual Models","This work introduces a method for transferring monolingual models to other languages through continuous pre-training and studies the effects of such transfer from four different languages to English, finding that model knowledge from the source language enhances the learning of syntactic and semantic knowledge in English.","International Conference on Language Resources and Evaluation",2021,"Evangelia Gogoulou,Ariel Ekgren,T. Isbister,Magnus Sahlgren",4,46,0,"https://www.semanticscholar.org/paper/ed4705fc97d35f8b02a4c11633cb6dd6bd316cc7"
"dec42306af017bc778bbf1496776f3cd4d5bd42e",1,"Pre-trained transformer-based language models for Sundanese","Three monolingual Transformer-based language models are pre-trained on Sundanese data that outperformed larger multilingual models despite the smaller overall pre-training data.","Journal of Big Data",2021,"Wilson Wongso,Henry Lucky,Derwin Suhartono",3,50,0,"https://www.semanticscholar.org/paper/dec42306af017bc778bbf1496776f3cd4d5bd42e"
"eb0024439858af7cc951ce2efa5a6533c3781799",1,"WECHSEL: Effective initialization of subword embeddings for cross-lingual transfer of monolingual language models","This work introduces a novel method – called WECHSEL – to efficiently and effectively transfer pretrained LMs to new languages and improves over proposed methods for cross-lingual parameter transfer and outperforms models of comparable size trained from scratch with up to 64x less training effort.","North American Chapter of the Association for Computational Linguistics",2021,"Benjamin Minixhofer,Fabian Paischer,Navid Rekabsaz",6,63,1,"https://www.semanticscholar.org/paper/eb0024439858af7cc951ce2efa5a6533c3781799"
"698a183048f9a81f5c37facfd5fd8454aa813f4c",1,"To Augment or Not to Augment? A Comparative Study on Text Augmentation Techniques for Low-Resource NLP","Three categories of text augmentation methodologies that perform changes on the syntax, token, and character levels are investigated, finding the experimented techniques to be effective on morphologically rich languages in general rather than analytic languages such as Vietnamese.","International Conference on Computational Logic",2021,"Gözde Gül Sahin",3,85,0,"https://www.semanticscholar.org/paper/698a183048f9a81f5c37facfd5fd8454aa813f4c"
"44f75282915d468413e38ac0e1f59b3ee6860485",1,"Does Transliteration Help Multilingual Language Modeling?","This paper pretrain two ALBERT models to empirically measure the effect of transliteration on Multilingual Language Models and finds that transliterating closely related languages that use different writing scripts to a common script may improve the downstream task performance of MLLMs.","ArXiv",2022,"Ibraheem Muhammad Moosa,Mahmud Elahi Akhter,Ashfia Binte Habib",1,57,0,"https://www.semanticscholar.org/paper/44f75282915d468413e38ac0e1f59b3ee6860485"
"63bafbf3e7cfdb576407870137b5751cbb579864",1,"Oolong: Investigating What Makes Crosslingual Transfer Hard with Controlled Studies","It is found that by far the most impactful factor for crosslingual transfer is the challenge of aligning the new embeddings with the existing transformer layers (18% drop), with little additional effect from switching tokenizers or word morphologies.","ArXiv",2022,"Zhengxuan Wu,Isabel Papadimitriou,Alex Tamkin",6,28,0,"https://www.semanticscholar.org/paper/63bafbf3e7cfdb576407870137b5751cbb579864"
"b28e23afe988ad83ab5bd9ce7f826c140c533be8",1,"Overlap-based Vocabulary Generation Improves Cross-lingual Transfer Among Related Languages","It is argued that relatedness among languages in a language family along the dimension of lexical overlap may be leveraged to overcome some of the corpora limitations of LRLs and proposed Overlap BPE (OBPE), a simple yet effective modification to the BPE vocabulary generation algorithm which enhances overlap across related languages.","Annual Meeting of the Association for Computational Linguistics",2022,"V. Patil,P. Talukdar,Sunita Sarawagi",3,42,1,"https://www.semanticscholar.org/paper/b28e23afe988ad83ab5bd9ce7f826c140c533be8"
"d97867578a50f824a19168c024e138e3ca482746",1,"Deep Lexical Hypothesis: Identifying personality structure in natural language","","Journal of Personality and Social Psychology",2022,"A. Cutler,D. Condon",0,138,0,"https://www.semanticscholar.org/paper/d97867578a50f824a19168c024e138e3ca482746"
"597cad6c7b9de94eecc153c7cdcaf824905fe915",1,"You Are What You Write: Preserving Privacy in the Era of Large Language Models","This paper presents the first wide coverage evaluation and comparison of some of the most popular privacy-preserving algorithms, on a large, multi-lingual dataset on sentiment analysis annotated with demographic information (location, age and gender).","ArXiv",2022,"Richard Plant,V. Giuffrida,Dimitra Gkatzia",0,146,0,"https://www.semanticscholar.org/paper/597cad6c7b9de94eecc153c7cdcaf824905fe915"
"04207549bf872158d117600029dbe1f1cf8e5b59",1,"Beyond Static models and test sets: Benchmarking the potential of pre-trained models across tasks and languages","It is proposed that the recent work done in Performance Prediction for NLP tasks can serve as a potential solution in fixing benchmarking in Multilingual NLP by utilizing features related to data and language typology to estimate the performance of an MMLM on different languages.","NLPPOWER",2022,"Kabir Ahuja,Sandipan Dandapat,Sunayana Sitaram,M. Choudhury",3,46,0,"https://www.semanticscholar.org/paper/04207549bf872158d117600029dbe1f1cf8e5b59"
"210980149a6b41d3e8d95c12daa41d6aa391681f",1,"Multi Task Learning For Zero Shot Performance Prediction of Multilingual Models","This work builds upon some of the existing techniques for predicting the zero-shot performance on a task, by modeling it as a multi-task learning problem, and identifies a common set of features that influence zero- shot performance across a variety of tasks.","Annual Meeting of the Association for Computational Linguistics",2022,"Kabir Ahuja,Shanu Kumar,Sandipan Dandapat,M. Choudhury",6,51,0,"https://www.semanticscholar.org/paper/210980149a6b41d3e8d95c12daa41d6aa391681f"
"99be6dc17a7fd399f4af80c4c1cd7ee5247591a1",1,"Pre-training Data Quality and Quantity for a Low-Resource Language: New Corpus and BERT Models for Maltese","The results show that using a mixture of pre-training domains is often superior to using Wikipedia text only, and that a fraction of this corpus is enough to make signiﬁcant leaps in performance over Wikipedia-trained models.","Workshop on Deep Learning Approaches for Low-Resource Natural Language Processing",2022,"Kurt Micallef,Albert Gatt,Marc Tanti,Lonneke van der Plas,Claudia Borg",1,45,0,"https://www.semanticscholar.org/paper/99be6dc17a7fd399f4af80c4c1cd7ee5247591a1"
"d69ec0bbc9fc4fe898ac8cb73f629d253358bf66",1,"Stop Filtering: Multi-View Attribute-Enhanced Dialogue Learning","A multi-view attribute-enhanced dialogue learning framework that strengthens the attribute-related features more robustly and comprehensively and can improve the performance of models by enhancing dialogue attributes and fusing view-speciﬁc knowledge.","ArXiv",2022,"Yiwei Li,Bin Sun,Shaoxiong Feng,Kan Li",1,67,0,"https://www.semanticscholar.org/paper/d69ec0bbc9fc4fe898ac8cb73f629d253358bf66"
"20b0452359524d15a6182269be51302df850f2a7",1,"hmBERT: Historical Multilingual Language Models for Named Entity Recognition","This work tackles NER for historical German, English, French, Swedish, and Finnish by training large historical language models by circumventing the need for labeled data by using unlabeled data for pretraining a language model.","Conference and Labs of the Evaluation Forum",2022,"Stefan Schweter,Luisa März,Katharina Schmid,Erion cCano",2,28,0,"https://www.semanticscholar.org/paper/20b0452359524d15a6182269be51302df850f2a7"
"6fd36dd51da2a18b53fc7bdb9797f279ceb80462",1,"Square One Bias in NLP: Towards a Multi-Dimensional Exploration of the Research Manifold","Historical and recent examples of how the square one bias has led researchers to draw false conclusions or make unwise choices are provided, point to promising yet unexplored directions on the research manifold, and make practical recommendations to enable more multi-dimensional research.","Findings",2022,"Sebastian Ruder,Ivan Vulic,Anders Søgaard",2,113,0,"https://www.semanticscholar.org/paper/6fd36dd51da2a18b53fc7bdb9797f279ceb80462"
"089fd688de463519a68bd25b11ae1c3eb57b207d",1,"Compositional Evaluation on Japanese Textual Entailment and Similarity","JSICK, a Japanese NLI/STS dataset that was manually translated from the English dataset SICK is intro-duce and a stress-test dataset for compositional inference is presented, created by transforming syntactic structures of sentences in JSICK to investigate whether language models are sensitive to word order and case particles.","Transactions of the Association for Computational Linguistics",2022,"Hitomi Yanaka,K. Mineshima",1,69,1,"https://www.semanticscholar.org/paper/089fd688de463519a68bd25b11ae1c3eb57b207d"
"52b65b29a3d9a7d9e8c016a156454ef8ad80858d",1,"BERTifying Sinhala - A Comprehensive Analysis of Pre-trained Language Models for Sinhala Text Classification","Out of the pre-trained multilingual models that include Sinhala (XLM-R, LaBSE, and LASER), XLM-R is the best model by far forSinhala text classification and is robust in situations where labeled data is insufficient for fine-tuning.","International Conference on Language Resources and Evaluation",2022,"Vinura Dhananjaya,Piyumal Demotte,Surangika Ranathunga,Sanath Jayasena",3,55,1,"https://www.semanticscholar.org/paper/52b65b29a3d9a7d9e8c016a156454ef8ad80858d"
"bd6f44bab6dbb5c93854f67f95f82274adc7d2d0",1,"MonoByte: A Pool of Monolingual Byte-level Language Models","Experiments on QA and NLI tasks show that monolingual models achieve competitive performance to the multilingual one, and hence can be served to strengthen the understanding of cross-lingual transferability in language models.","International Conference on Computational Linguistics",2022,"H. Abonizio,Leandro Rodrigues de Souza,R. Lotufo,Rodrigo Nogueira",0,45,0,"https://www.semanticscholar.org/paper/bd6f44bab6dbb5c93854f67f95f82274adc7d2d0"
"e874510a64c90ec41659338b1f1f6baee1736a15",1,"You Can Have Your Data and Balance It Too: Towards Balanced and Efficient Multilingual Models","This work proposes a novel multilingual training technique based on teacher-student knowledge distillation based on monolingual teacher models optimized for their language that out-performs standard training methods in low-resource languages and retrains performance on high- resource languages, while using the same amount of data.","ArXiv",2022,"Tomasz Limisiewicz,Daniel Malkin,G. Stanovsky",0,15,0,"https://www.semanticscholar.org/paper/e874510a64c90ec41659338b1f1f6baee1736a15"
"22fbef2bfef213a7619ee4f307e8f42d1888e638",1,"LVP-M3: Language-aware Visual Prompt for Multilingual Multimodal Machine Translation","An effective baseline LVP-M 3 using visual prompts is proposed to support translations between different languages, which includes three stages (token encoding, language-aware visual prompt generation, and language translation).","ArXiv",2022,"Hongcheng Guo,Jiaheng Liu,Haoyang Huang,Jian Yang,Zhoujun Li,Dongdong Zhang,Furu Wei",1,58,0,"https://www.semanticscholar.org/paper/22fbef2bfef213a7619ee4f307e8f42d1888e638"
"d3a01c0aeddb98b749bb48c97a48310e91e66d36",1,"Multilingual Multimodality: A Taxonomical Survey of Datasets, Techniques, Challenges and Opportunities","The main goal of this work is to catalogue and characterize these works by charting out the categories of tasks, datasets and methods to address MultiX scenarios and review the languages studied, gold or silver data with parallel annotations, and understand how these modalities and languages interact in modeling.","ArXiv",2022,"Khyathi Raghavi Chandu,A. Geramifard",1,133,0,"https://www.semanticscholar.org/paper/d3a01c0aeddb98b749bb48c97a48310e91e66d36"
"296c9f9ba0139a3d7c7a1197960a1c9bce5141e7",1,"Punctuation Restoration for Singaporean Spoken Languages: English, Malay, and Mandarin","This work adopts a slot-filling approach that predicts the presence and type of punctuation marks at each word boundary, similar to the Masked-Language Model approach employed during the pre-training stages of BERT but instead of predicting the masked word, the model predicts masked punctuation.","Asia-Pacific Signal and Information Processing Association Annual Summit and Conference",2022,"Abhinav K. Rao,Ho Thi-Nga,Chng Eng Siong",0,44,0,"https://www.semanticscholar.org/paper/296c9f9ba0139a3d7c7a1197960a1c9bce5141e7"
"15a802ca1e77e678db79f61e36cf9eaf6b273c24",1,"MultiCoder: Multi-Programming-Lingual Pre-Training for Low-Resource Code Completion","The MultiCoder is proposed to enhance the low-resource code completion via MultiPL pre-training and MultiPL Mixture-of-Experts (MoE) layers and a novel PL-level MoE routing strategy ( PL-MoE ) for improving the code completion on all PLs.","ArXiv",2022,"Zi Gong,Yinpeng Guo,Pingyi Zhou,Cuiyun Gao,Yasheng Wang,Zenglin Xu",0,37,0,"https://www.semanticscholar.org/paper/15a802ca1e77e678db79f61e36cf9eaf6b273c24"
"6cc1d05250511e596e3607827fda4614abb6ed74",1,"Neural Transfer Learning with Transformers for Social Science Text Analysis","Three Transformer-based models for transfer learning, BERT, RoBERTa, and the Longformer, are compared to conventional machine learning algorithms on three applications and the conventional models are consistently outperformed by transfer learning with Transformers, thereby demonstrating the benefits these models can bring to text-based social science research.","Sociological Methods &amp; Research",2022,"Sandra Wankmüller",2,68,0,"https://www.semanticscholar.org/paper/6cc1d05250511e596e3607827fda4614abb6ed74"
"44e67f6bdb132fadff230b961e61304804f32657",1,"Mini-Model Adaptation: Efficiently Extending Pretrained Models to New Languages via Aligned Shallow Training","mini-model adaptation is proposed, a compute-efﬁcient alternative that builds a shallow mini-model from a fraction of a large model’s parameters and matches the performance of the standard approach using up to 2.4x less compute.","ArXiv",2022,"Kelly Marchisio,Patrick Lewis,Yihong Chen,Mikel Artetxe",0,36,0,"https://www.semanticscholar.org/paper/44e67f6bdb132fadff230b961e61304804f32657"
"bfff952fb890f3eb4ba22718f1df70a030741b74",1,"Cross-Linguistic Syntactic Difference in Multilingual BERT: How Good is It and How Does It Affect Transfer?","","ArXiv",2022,"Ningyu Xu,Tao Gui,Ruotian Ma,Qi Zhang,Jingting Ye,Menghan Zhang,Xuanjing Huang",0,63,0,"https://www.semanticscholar.org/paper/bfff952fb890f3eb4ba22718f1df70a030741b74"
"055367775f92ab03d53c470f42bc7284d4a256d8",1,"KOAS: Korean Text Offensiveness Analysis System","KOAS is presented, a system that fully exploits both contextual and linguistic features and estimates an offensiveness score for a text and constructed a Korean dataset for offensive analysis from various domains.","Conference on Empirical Methods in Natural Language Processing",2021,"S. Park,Kang-Min Kim,Seonhee Cho,Jun-Hyung Park,Hyuntae Park,Hyuna Kim,Seon-Young Chung,SangKeun Lee",0,26,0,"https://www.semanticscholar.org/paper/055367775f92ab03d53c470f42bc7284d4a256d8"
"710033d861e50f80b28c1fa68316c9ea8ab3c42c",1,"Prediction Difference Regularization against Perturbation for Neural Machine Translation","This paper utilizes prediction difference for ground-truth tokens to analyze the fitting of token-level samples and finds that under-fitting is almost as common as over-fitting, so prediction difference regularization (PD-R) is introduced, a simple and effective method that can reduce over- fitting and under- fitting at the same time.","Annual Meeting of the Association for Computational Linguistics",2022,"Dengji Guo,Zhengrui Ma,M. Zhang,Yanghe Feng",3,45,0,"https://www.semanticscholar.org/paper/710033d861e50f80b28c1fa68316c9ea8ab3c42c"
"457e73be2f876e0b838f0f8d7aa921993b7f607d",1,"Consistency Training with Virtual Adversarial Discrete Perturbation","This work proposes an augmentation method of adding a discrete noise that would incur the highest divergence between predictions that outperforms other consistency training baselines with text editing, paraphrasing, or a continuous noise on semi-supervised text classification tasks and a robustness benchmark.","North American Chapter of the Association for Computational Linguistics",2021,"Jungsoo Park,Gyuwan Kim,Jaewoo Kang",7,73,1,"https://www.semanticscholar.org/paper/457e73be2f876e0b838f0f8d7aa921993b7f607d"
"5bfb0b5494885d35bc15952c025fa2d8fbbd8c98",1,"Explicit Contextual Semantics for Text Comprehension","This paper makes the first attempt to let SRL enhance text comprehension and inference through specifying verbal predicates and their corresponding semantic roles, and shows that the salient labels can be conveniently added to existing models and significantly improve deep learning models in challenging text comprehension tasks.","ArXiv",2018,"Zhuosheng Zhang,Yuwei Wu,Z. Li,Hai Zhao",27,57,5,"https://www.semanticscholar.org/paper/5bfb0b5494885d35bc15952c025fa2d8fbbd8c98"
"c70df347923d90e05ff19ebd724ffc2fd6232594",1,"Neural-based Pinyin-to-Character Conversion with Adaptive Vocabulary","A neural P2C conversion model augmented by a large online updating vocabulary with a target vocabulary sampling mechanism is proposed that reduces the decoding time on CPUs up to 50$\%$ on pinyin-to-character tasks at the same or only negligible change in conversion accuracy.","ArXiv",2018,"Yafang Huang,Zhuosheng Zhang,Hai Zhao",1,40,0,"https://www.semanticscholar.org/paper/c70df347923d90e05ff19ebd724ffc2fd6232594"
"c8e707a0ea3a1f3bc104f191e72c4444b28be834",1,"SJTU at MRP 2019: A Transition-Based Multi-Task Parser for Cross-Framework Meaning Representation Parsing","This work defines a set of the transition actions to once-for-all tackle all the frameworks and train a transition-based model to parse the meaning representation and achieves 42% F1 unified MRP metric score in the CoNLL 2019 Shared Task.","Conference on Computational Natural Language Learning",2019,"Hongxiao Bai,Zhao Hai",8,45,2,"https://www.semanticscholar.org/paper/c8e707a0ea3a1f3bc104f191e72c4444b28be834"
