"id","score","title","summary","venue","year","authors","citationCount","referenceCount","influentialCitationCount","url"
"23f4b6432b74e5db05da04e354341807f5044f7e",12,"Language Modelling with Pixels","PIXEL is a pretrained language model that renders text as images, making it possible to transfer representations across languages based on orthographic similarity or the co-activation of pixels, and is more robust than BERT to orthographic attacks and linguistic code-switching, further confirming the benefits of modelling language with pixels.","International Conference on Learning Representations",2022,"Phillip Rust,Jonas F. Lotz,Emanuele Bugliarello,Elizabeth Salesky,Miryam de Lhoneux,Desmond Elliott",22,145,2,"https://www.semanticscholar.org/paper/23f4b6432b74e5db05da04e354341807f5044f7e"
"a0568d0bf4cbfcb5a17a20c576dfc421c4ccfb7c",11,"Incorporating Context into Subword Vocabularies","SaGe, a tokenizer that tailors subwords for their downstream use by baking in the contextualized signal at the vocabulary creation phase, is presented, showing its robustness to language properties such as morphological exponence and agglutination.","Conference of the European Chapter of the Association for Computational Linguistics",2022,"Shaked Yehezkel,Yuval Pinter",3,49,0,"https://www.semanticscholar.org/paper/a0568d0bf4cbfcb5a17a20c576dfc421c4ccfb7c"
"67c28d697460b684a0ba97d989719b4ed3c9cffc",7,"Elementwise Language Representation","Using this novel approach, the standard transformer architecture can be reused for all levels of language representations and be able to process much longer sequences at the same time-complexity without""any""architectural modification and additional overhead.","arXiv.org",2023,"Du-Yeong Kim,Jeeeun Kim",0,58,0,"https://www.semanticscholar.org/paper/67c28d697460b684a0ba97d989719b4ed3c9cffc"
"4044c062683533d92f598715afe2508be29c739c",7,"The Hidden Folk: Linguistic Properties Encoded in Multilingual Contextual Character Representations","The multilingual contextual CANINE model is probed, including Faroese as an additional zero-shot instance, and it is observed that some phonetic information is indeed encoded in the character representations, as consonants and vowels can be well distinguished using a linear classifier.","CAWL",2023,"Manex Agirrezabal,Sidsel Boldsen,Nora Hollenstein",0,30,0,"https://www.semanticscholar.org/paper/4044c062683533d92f598715afe2508be29c739c"
"96713d3a63f18ce13ded2a3c5569d3eeba161c49",6,"CompoundPiece: Evaluating and Improving Decompounding Performance of Language Models","This work systematically study decompounding, the task of splitting compound words into their constituents, at a wide scale and uses self-supervised models to leverage decompounding during the creation of a subword tokenizer, which it refers to as CompoundPiece.","arXiv.org",2023,"Benjamin Minixhofer,Jonas Pfeiffer,Ivan Vulic",0,62,0,"https://www.semanticscholar.org/paper/96713d3a63f18ce13ded2a3c5569d3eeba161c49"
"17fbffb05fa14e21d1c506fd5f0f568b955fe983",6,"Do All Languages Cost the Same? Tokenization in the Era of Commercial Language Models","This work conducts a systematic analysis of the cost and utility of OpenAI's language model API on multilingual benchmarks in 22 typologically diverse languages and shows evidence that speakers of a large number of the supported languages are overcharged while obtaining poorer results.","arXiv.org",2023,"Orevaoghene Ahia,Sachin Kumar,Hila Gonen,Jungo Kasai,David R. Mortensen,Noah A. Smith,Yulia Tsvetkov",2,72,1,"https://www.semanticscholar.org/paper/17fbffb05fa14e21d1c506fd5f0f568b955fe983"
"f8ef90a8cac1a8edf9477688aac24864c547d6cd",6,"Character-Aware Models Improve Visual Text Rendering","This paper trains a suite of image generation models, and shows that character-aware variants outperform their character-blind counterparts across a range of novel text rendering tasks (the authors' DrawText benchmark), and sets a much higher state-of-the-art on visual spelling.","Annual Meeting of the Association for Computational Linguistics",2022,"Rosanne Liu,Daniel H Garrette,Chitwan Saharia,William Chan,Adam Roberts,Sharan Narang,Irina Blok,R. Mical,Mohammad Norouzi,Noah Constant",17,182,6,"https://www.semanticscholar.org/paper/f8ef90a8cac1a8edf9477688aac24864c547d6cd"
"0232715f9089e3a2fc002cff6737bb9939805b8d",5,"Local Byte Fusion for Neural Machine Translation","A Local Byte Fusion (LOBEF) method for byte-based machine translation—utilizing byte n-gram and word boundaries—to aggregate local semantic information to perform competitive to subword models.","Annual Meeting of the Association for Computational Linguistics",2022,"Makesh Narsimhan Sreedhar,Xiangpeng Wan,Yu-Jie Cheng,Junjie Hu",0,45,0,"https://www.semanticscholar.org/paper/0232715f9089e3a2fc002cff6737bb9939805b8d"
"5079e188ae86d8330414edb65e898ed306ac450d",5,"Subword Segmental Machine Translation: Unifying Segmentation and Target Sentence Generation","SSMT unifies subword segmentation and MT in a single trainable model that learns to segment target sentence words while jointly learning to generate target sentences and proves more robust on a test set constructed for evaluating morphological compositional generalisation.","Annual Meeting of the Association for Computational Linguistics",2023,"Francois Meyer,Jan Buys",0,35,0,"https://www.semanticscholar.org/paper/5079e188ae86d8330414edb65e898ed306ac450d"
"29a54c072bcf85fa6934b6f701962a7c9aeb6489",5,"Byte-Level Grammatical Error Correction Using Synthetic and Curated Corpora","It is shown that a byte-level model enables higher correction quality than a subword approach, not only for simple spelling errors, but also for more complex semantic, stylistic and grammatical issues.","Annual Meeting of the Association for Computational Linguistics",2023,"Svanhv'it Lilja Ing'olfsd'ottir,Pétur Orri Ragnarsson,H. Jónsson,Haukur Barri S'imonarson,Vilhjálmur Þorsteinsson,Vésteinn Snæbjarnarson",0,59,0,"https://www.semanticscholar.org/paper/29a54c072bcf85fa6934b6f701962a7c9aeb6489"
"ec8f75e22ffbb5ad7e2f9cfc20a7780eed45715b",5,"CLIPPO: Image-and-Language Understanding from Pixels Only","The fact that CLIPPO does not require a tokenizer is exploited to show that it can achieve strong performance on multilingual multimodal retrieval without modifications, and it can obtain good accuracy in visual question answering, simply by rendering the question and image together.","Computer Vision and Pattern Recognition",2022,"M. Tschannen,Basil Mustafa,N. Houlsby",16,87,1,"https://www.semanticscholar.org/paper/ec8f75e22ffbb5ad7e2f9cfc20a7780eed45715b"
"0290943797ce77535c7b448dc86f4f97d344332e",5,"Language Model Tokenizers Introduce Unfairness Between Languages","It is shown how disparity in the treatment of different languages arises at the tokenization stage, well before a model is even invoked, and the case is made that future language models should be trained using multilingually fair tokenizers.","arXiv.org",2023,"Aleksandar Petrov,Emanuele La Malfa,Philip H. S. Torr,Adel Bibi",6,107,1,"https://www.semanticscholar.org/paper/0290943797ce77535c7b448dc86f4f97d344332e"
"6237a49297f45ebfdeabbbf67d06de323d1fccd4",5,"Pixel Representations for Multilingual Translation and Data-efficient Cross-lingual Transfer","It is observed that various properties of pixel representations not only enable seamless cross-lingual transfer to unseen scripts, but make pixel representations more data-efficient than alternatives such as vocabulary expansion.","arXiv.org",2023,"Elizabeth Salesky,Neha Verma,Philipp Koehn,Matt Post",0,40,0,"https://www.semanticscholar.org/paper/6237a49297f45ebfdeabbbf67d06de323d1fccd4"
"5bd254c0775d18cdc30cb85be61e080484ee6713",5,"Multilingual Text Representation","Light is shed on this iterative progression of multilingual text representation and the driving factors that ultimately led to the current state-of-the-art, and how the full potential of language democratization could be obtained is discussed.","arXiv.org",2023,"FAHIM FAISAL",0,75,0,"https://www.semanticscholar.org/paper/5bd254c0775d18cdc30cb85be61e080484ee6713"
"117a0c2c23a5a558cf3b39468d917a750bca720c",5,"Are Character-level Translations Worth the Wait? Comparing Character- and Subword-level Models for Machine Translation","This work performs an extensive comparison across multiple languages and experimental conditions of state-of-the-art character- and subword-level pre-trained models on NMT, showing the effectiveness of character-level modeling in translation, particularly in cases where training data is limited.","",2023,"Lukas Edman,Gabriele Sarti,Antonio Toral,Gertjan van Noord,Arianna Bisazza",1,37,0,"https://www.semanticscholar.org/paper/117a0c2c23a5a558cf3b39468d917a750bca720c"
"9ccad0208b50042d8378b77700146a98bd22ea3f",5,"The SIGMORPHON 2022 Shared Task on Morpheme Segmentation","","Special Interest Group on Computational Morphology and Phonology Workshop",2022,"Khuyagbaatar Batsuren,Gábor Bella,Aryaman Arora,Viktor Martinovi'c,Kyle Gorman,Zdenvek vZabokrtsk'y,A. Ganbold,vS'arka Dohnalov'a,Magda vSevvc'ikov'a,Katevrina Pelegrinov'a,Fausto Giunchiglia,Ryan Cotterell,Ekaterina Vylomova",14,81,0,"https://www.semanticscholar.org/paper/9ccad0208b50042d8378b77700146a98bd22ea3f"
"0f8f20ef4bc90a2b210bc5be08a7f326a214556f",5,"An Information Extraction Study: Take In Mind the Tokenization!","The main outcome is twofold: tokenization patterns can introduce inductive bias that results in state-of-the-art performance, and the character-based models produce promising results; thus, transitioning to token-free IE models is feasible.","EUSFLAT/AGOP",2023,"Christos Theodoropoulos,Marie-Francine Moens",1,41,0,"https://www.semanticscholar.org/paper/0f8f20ef4bc90a2b210bc5be08a7f326a214556f"
"d7a379254ac2dee2e31dfdeedb440176f0285aa5",5,"From Characters to Words: Hierarchical Pre-trained Language Model for Open-vocabulary Language Understanding","This work introduces a novel open-vocabulary language model that adopts a hierarchical two-level approach: one at the word level and another at the sequence level, and demonstrates that this hierarchical model is robust to textual corruption and domain shift.","Annual Meeting of the Association for Computational Linguistics",2023,"Li Sun,F. Luisier,K. Batmanghelich,D. Florêncio,Changrong Zhang",0,54,0,"https://www.semanticscholar.org/paper/d7a379254ac2dee2e31dfdeedb440176f0285aa5"
"035315281c72763a3e0956775732e64f5f193d82",4,"Natural Language Generation with Pixels","A conditional diffusion-based decoder for modeling rendered natural language that is capable of generating coherent, plausible natural language rendered as images and compared with strong transformer-based autoregressive baselines in both the unconditional and sequence-to-sequence setting.","",2023,"",0,44,0,"https://www.semanticscholar.org/paper/035315281c72763a3e0956775732e64f5f193d82"
"5dee4ece8ec1725a7d071b74bf60f4f5fd2e78ad",4,"Sub-Character Tokenization for Chinese Pretrained Language Models","Experimental results show that SubChar tokenizers have two main advantages over existing tokenizers: 1) They can tokenize inputs into much shorter sequences, thus improving the computational efficiency, and 2) Pronunciation-based SubChartokenization can encode Chinese homophones into the same transliteration sequences and produce the same tokenization output, hence being robust to homophone typos.","International Conference on Topology, Algebra and Categories in Logic",2021,"Chenglei Si,Zhengyan Zhang,Yingfa Chen,Fanchao Qi,Xiaozhi Wang,Zhiyuan Liu,Yasheng Wang,Qun Liu,Maosong Sun",2,61,0,"https://www.semanticscholar.org/paper/5dee4ece8ec1725a7d071b74bf60f4f5fd2e78ad"
"0de580957d23dd65e31b6c95e6bc5d15bc15c57d",4,"Impact of Tokenization on Language Models: An Analysis for Turkish","This work compares five tokenizers at different granularity levels, that is, their outputs vary from the smallest pieces of characters to the surface form of words, and finds that increasing the vocabulary size improves the performance of Morphological- and Word-level tokenizers more than that of de facto tokenizers.","ACM Trans. Asian Low Resour. Lang. Inf. Process.",2022,"Cagri Toraman,E. Yilmaz,Furkan Şahinuç,Oguzhan Ozcelik",15,68,3,"https://www.semanticscholar.org/paper/0de580957d23dd65e31b6c95e6bc5d15bc15c57d"
"c08c2fd7b269bd9d6c1162adc3b059cdf21d40a6",4,"Lifting the Curse of Multilinguality by Pre-training Modular Transformers","This work introduces language-specific modules of their Cross-lingual Modular models from the start, which allows them to grow the total capacity of the model, while keeping the total number of trainable parameters per language constant.","North American Chapter of the Association for Computational Linguistics",2022,"Jonas Pfeiffer,Naman Goyal,Xi Victoria Lin,Xian Li,James Cross,Sebastian Riedel,Mikel Artetxe",58,80,3,"https://www.semanticscholar.org/paper/c08c2fd7b269bd9d6c1162adc3b059cdf21d40a6"
"7cdebb73662387d9040da4f27a7dc04dbffa3c3e",4,"ByGPT5: End-to-End Style-conditioned Poetry Generation with Token-free Language Models","This work successfully pre-train ByGPT5, a new token-free decoder-only language model, and fine-tune it on a large custom corpus of English and German quatrains annotated with the authors' styles, and shows that ByG PT5 outperforms other models such as mT5, ByT4, GPT-2 and ChatGPT, while also being more parameter efficient and performing favorably compared to humans.","Annual Meeting of the Association for Computational Linguistics",2022,"Jonas Belouadi,Steffen Eger",4,79,0,"https://www.semanticscholar.org/paper/7cdebb73662387d9040da4f27a7dc04dbffa3c3e"
"ea8197cb357af6f89e8b6e5548897236a24719b1",4,"What is the best recipe for character-level encoder-only modelling?","This paper aims to benchmark recent progress in language understanding models that output contextualised representations at the character level, and finds that the best performing character-level model exceeds the performance of a token-based model trained with the same settings on the same data.","Annual Meeting of the Association for Computational Linguistics",2023,"Kris Cao",0,41,0,"https://www.semanticscholar.org/paper/ea8197cb357af6f89e8b6e5548897236a24719b1"
"ed7b51e4a5c4835218f6697b280afb2849211939",4,"Are Character-level Translations Worth the Wait? An Extensive Comparison of Character- and Subword-level Models for Machine Translation","An extensive comparison across multiple languages and experimental conditions of state-of-the-art character- and subword-level pre-trained models on NMT shows that the former not only are effective in translation, but frequently outperform subword models, particularly in cases where training data is limited.","arXiv.org",2023,"Lukas Edman,Antonio Toral,Gertjan van Noord",0,28,0,"https://www.semanticscholar.org/paper/ed7b51e4a5c4835218f6697b280afb2849211939"
"5b0c0d181f31acebf2442e7b7c7af27f3f6a5f4a",4,"Hints on the data for language modeling of synthetic languages with transformers","To what extent the critical amount of data varies for languages of different morphological typology, in particular those that have a rich inflectional morphology, and whether the tokenization method to preprocess the data can make a difference, is addressed.","Annual Meeting of the Association for Computational Linguistics",2023,"Rodolfo Zevallos,Núria Bel",0,39,0,"https://www.semanticscholar.org/paper/5b0c0d181f31acebf2442e7b7c7af27f3f6a5f4a"
"14efaa989b8db89ad907e6a15253d482cbba77d9",4,"Linguistically inspired roadmap for building biologically reliable protein language models","It is argued that guidance drawn from linguistics, a field specialized in analytical rule extraction from natural language data, can aid with building more interpretable protein LMs that are more likely to learn relevant domain-specific rules.","Nature Machine Intelligence",2022,"Mai Ha Vu,R. Akbar,Philippe A. Robert,B. Swiatczak,G. K. Sandve,V. Greiff,Dag Trygve Tryslew Haug",8,133,0,"https://www.semanticscholar.org/paper/14efaa989b8db89ad907e6a15253d482cbba77d9"
"d406bde1a09890a4947e626c7f538eef693e7adf",4,"Morpheme-Based Neural Machine Translation Models for Low-Resource Fusion Languages","A word segmentation method that segments words by restoring the altered morphemes of a word in fusion languages and it is proved that morpheme-based models outperform conventional subword models on a benchmark dataset.","ACM Transactions on Asian and Low-Resource Language Information Processing",2023,"A. Gezmu,A. Nürnberger",0,79,0,"https://www.semanticscholar.org/paper/d406bde1a09890a4947e626c7f538eef693e7adf"
"e4d2ba4cb6f364079ce3731e86b860264677ae7d",3,"Downstream Task-Oriented Neural Tokenizer Optimization with Vocabulary Restriction as Post Processing","An example of the BiLSTM-based tokenizer with vocabulary restriction is proposed, which can capture wider contextual information for the tokenization process than non-neural-basedtokenization methods used in existing work.","arXiv.org",2023,"Tatsuya Hiraoka,Tomoya Iwakura",0,26,0,"https://www.semanticscholar.org/paper/e4d2ba4cb6f364079ce3731e86b860264677ae7d"
"e79d1206292bc5e67ba19737d87d4b2ea4a37105",3,"Charformer: Fast Character Transformers via Gradient-based Subword Tokenization","A soft gradient-based subword tokenization module (GBST) that automatically learns latent subword representations from characters in a data-driven fashion is introduced that paves the way for highly performant token-free models that are trained completely end-to-end.","International Conference on Learning Representations",2021,"Yi Tay,Vinh Q. Tran,Sebastian Ruder,Jai Gupta,Hyung Won Chung,Dara Bahri,Zhen Qin,Simon Baumgartner,Cong Yu,Donald Metzler",85,70,15,"https://www.semanticscholar.org/paper/e79d1206292bc5e67ba19737d87d4b2ea4a37105"
"3e08d84af266026e7d254729f3afc6dcd572d264",3,"One does not fit all! On the Complementarity of Vision Encoders for Vision and Language Tasks","This work exhaustively experiments with three popular VEs on six downstream V+L tasks and suggests that diverse VEs complement each other, resulting in improved downstream V-L task performance, where the improvements are not due to simple ensemble effects.","Workshop on Representation Learning for NLP",2022,"Gregor Geigle,Chen Cecilia Liu,Jonas Pfeiffer,Iryna Gurevych",0,58,0,"https://www.semanticscholar.org/paper/3e08d84af266026e7d254729f3afc6dcd572d264"
"69b8db33a7ea7366e48c465b6f35a8d7f8f1a3b5",3,"XLM-V: Overcoming the Vocabulary Bottleneck in Multilingual Masked Language Models","A new approach for scaling to very large multilingual vocabularies is introduced by de-emphasizing token sharing between languages with little lexical overlap and assigning vocabulary capacity to achieve sufficient coverage for each individual language.","arXiv.org",2023,"Davis Liang,Hila Gonen,Yuning Mao,Rui Hou,Naman Goyal,Marjan Ghazvininejad,Luke Zettlemoyer,Madian Khabsa",11,34,2,"https://www.semanticscholar.org/paper/69b8db33a7ea7366e48c465b6f35a8d7f8f1a3b5"
"3d3f8399d625238fddb366697acb73446129d65c",3,"Revisiting Pre-trained Language Models and their Evaluation for Arabic Natural Language Processing","This work addresses two major problems in existing Arabic PLMs that limit the progress of the Arabic NLU and NLG fields and releases three new Arabic BERT-style models, and achieves a new state-of-the-art performance on discriminative and generative ArabicNLU andNLG tasks.","Conference on Empirical Methods in Natural Language Processing",2022,"Abbas Ghaddar,Yimeng Wu,Sunyam Bagga,Ahmad Rashid,Khalil Bibi,Mehdi Rezagholizadeh,Chao Xing,Yasheng Wang,Xinyu Duan,Zhefeng Wang,Baoxing Huai,Xin Jiang,Qun Liu,P. Langlais",2,90,0,"https://www.semanticscholar.org/paper/3d3f8399d625238fddb366697acb73446129d65c"
"24fbe3af030f393e55bda3dc7dae0f57bd270d04",3,"Revisiting Pre-trained Language Models and their Evaluation for Arabic Natural Language Understanding","This work revisits both the pre-training and evaluation of existing Arabic PLMs and releases three new Arabic BERT-style models, and achieves a new state-of-the-art performance on discriminative and generative Arabic NLU and NLG tasks.","arXiv.org",2022,"Abbas Ghaddar,Yimeng Wu,Sunyam Bagga,Ahmad Rashid,Khalil Bibi,Mehdi Rezagholizadeh,Chao Xing,Yasheng Wang,Duan Xinyu,Zhefeng Wang,Baoxing Huai,Xin Jiang,Qun Liu,P. Langlais",2,83,0,"https://www.semanticscholar.org/paper/24fbe3af030f393e55bda3dc7dae0f57bd270d04"
"36e1b3973c673d3c323014a168e05c5762f84262",3,"OneCAD: One Classifier for All image Datasets using multimodal learning","This work addresses the question: Is it possible to create a number-of-class-agnostic model architecture and proposes a training and inference framework OneCAD (One Classifier for All image Datasets) to achieve close-to number- of-class,agnostic transformer model.","arXiv.org",2023,"S. Wadekar,E. Culurciello",0,32,0,"https://www.semanticscholar.org/paper/36e1b3973c673d3c323014a168e05c5762f84262"
"491eaab2ff93772d52be8c014bf97466d8c6fe73",3,"Tokenization Tractability for Human and Machine Learning Model: An Annotation Study","A quantitative investigation result is provided that shows the tractable tokenizations for humans and machine learning models are not necessarily the same as each other.","arXiv.org",2023,"Tatsuya Hiraoka,Tomoya Iwakura",0,39,0,"https://www.semanticscholar.org/paper/491eaab2ff93772d52be8c014bf97466d8c6fe73"
"e5f6506f9332fcdb574f13a791e4f3c42b80ca90",3,"Demystifying Neural Language Models' Insensitivity to Word-Order","Investigating the insensitivity of natural language models to word-order by quantifying perturbations and analysing their effect on neural models’ performance on language understanding tasks in GLUE benchmark finds that neural language models — pretrained and non-pretrained Transformers, LSTMs, and Convolutional architectures — require local ordering more so than the global ordering of tokens.","arXiv.org",2021,"Louis Clouâtre,Prasanna Parthasarathi,A. Zouaq,Sarath Chandar",10,69,1,"https://www.semanticscholar.org/paper/e5f6506f9332fcdb574f13a791e4f3c42b80ca90"
"d53d4ff9f3bda51534184344845a78f8c02badd9",3,"DiatopIt: A Corpus of Social Media Posts for the Study of Diatopic Language Variation in Italy","The first corpus specifically focused on diatopic language variation in Italy for language varieties other than Standard Italian is introduced, and the representativeness of DiatopIt is assessed, and it is shown that the density of non-Standard Italian content across areas correlates with actual language use.","Workshop on NLP for Similar Languages, Varieties and Dialects",2023,"Alan Ramponi,Camilla Casula",2,31,0,"https://www.semanticscholar.org/paper/d53d4ff9f3bda51534184344845a78f8c02badd9"
"91c3f9ed60a383f97a8c38f1e6a28a0e9be232fa",3,"Local Structure Matters Most: Perturbation Study in NLU","It is empirically shown that neural models, invariant of their inductive biases, pretraining scheme, or the choice of tokenization, mostly rely on the local structure of text to build understanding and make limited use of the global structure.","Findings",2021,"Louis Clouâtre,Prasanna Parthasarathi,A. Zouaq,Sarath Chandar",4,69,0,"https://www.semanticscholar.org/paper/91c3f9ed60a383f97a8c38f1e6a28a0e9be232fa"
"9933a5af7895354087baf6c96b64dc8a8973eaed",3,"Perceiver IO: A General Architecture for Structured Inputs & Outputs","This work proposes Perceiver IO, a general-purpose architecture that handles data from arbitrary settings while scaling linearly with the size of inputs and outputs and augments the Perceiver with a flexible querying mechanism that enables outputs of various sizes and semantics, doing away with the need for task-specific architecture engineering.","International Conference on Learning Representations",2021,"Andrew Jaegle,Sebastian Borgeaud,Jean-Baptiste Alayrac,Carl Doersch,Catalin Ionescu,David Ding,Skanda Koppula,Andrew Brock,Evan Shelhamer,Olivier J. H'enaff,M. Botvinick,Andrew Zisserman,Oriol Vinyals,João Carreira",311,103,48,"https://www.semanticscholar.org/paper/9933a5af7895354087baf6c96b64dc8a8973eaed"
"231e768f0cd280faa0f725bb353262cb4fed08d1",3,"Hierarchical Transformers Are More Efficient Language Models","Hourglass is created - a hierarchical Transformer language model that improves language modeling efficiency on the widely studied enwik8 benchmark and sets new state-of-the-art for Transformer models on the ImageNet32 generation task.","NAACL-HLT",2021,"Piotr Nawrot,Szymon Tworkowski,Michał Tyrolski,Lukasz Kaiser,Yuhuai Wu,Christian Szegedy,H. Michalewski",22,38,1,"https://www.semanticscholar.org/paper/231e768f0cd280faa0f725bb353262cb4fed08d1"
"54123c8de8ecacb30ae2e9fb8c4635f4030965b5",3,"MockingBERT: A Method for Retroactively Adding Resilience to NLP Models","A novel method of retroactively adding resilience to misspellings to transformer-based NLP models without the need for re-training of the original NLP model is proposed, which significantly reduces the cost needed to evaluate a model’s resilience to adversarial attacks.","International Conference on Computational Linguistics",2022,"Jan Jezabek,A. Singh",0,27,0,"https://www.semanticscholar.org/paper/54123c8de8ecacb30ae2e9fb8c4635f4030965b5"
"110250df2a6ca0e0e609eaa800a21c17abeedd77",3,"NLP for Language Varieties of Italy: Challenges and the Path Forward","","arXiv.org",2022,"Alan Ramponi",5,89,1,"https://www.semanticscholar.org/paper/110250df2a6ca0e0e609eaa800a21c17abeedd77"
