"id","score","title","summary","venue","year","authors","citationCount","referenceCount","influentialCitationCount","url"
"9ccad0208b50042d8378b77700146a98bd22ea3f",4,"The SIGMORPHON 2022 Shared Task on Morpheme Segmentation","","Special Interest Group on Computational Morphology and Phonology Workshop",2022,"Khuyagbaatar Batsuren,Gábor Bella,Aryaman Arora,Viktor Martinovi'c,Kyle Gorman,Zdenvek vZabokrtsk'y,A. Ganbold,vS'arka Dohnalov'a,Magda vSevvc'ikov'a,Katevrina Pelegrinov'a,Fausto Giunchiglia,Ryan Cotterell,Ekaterina Vylomova",5,81,0,"https://www.semanticscholar.org/paper/9ccad0208b50042d8378b77700146a98bd22ea3f"
"e79d1206292bc5e67ba19737d87d4b2ea4a37105",3,"Charformer: Fast Character Transformers via Gradient-based Subword Tokenization","This paper introduces a soft gradient-based subword tokenization module (GBST) that automatically learns latent subword representations from characters in a data-driven fashion and paves the way for highly performant token-free models that are trained completely end-to-end.","International Conference on Learning Representations",2021,"Yi Tay,V. Tran,Sebastian Ruder,Jai Gupta,Hyung Won Chung,Dara Bahri,Zhen Qin,Simon Baumgartner,Cong Yu,Donald Metzler",55,69,11,"https://www.semanticscholar.org/paper/e79d1206292bc5e67ba19737d87d4b2ea4a37105"
"c08c2fd7b269bd9d6c1162adc3b059cdf21d40a6",3,"Lifting the Curse of Multilinguality by Pre-training Modular Transformers","This work introduces language-specific modules of their Cross-lingual Modular models from the start, which allows them to grow the total capacity of the model, while keeping the total number of trainable parameters per language constant.","North American Chapter of the Association for Computational Linguistics",2022,"Jonas Pfeiffer,Naman Goyal,Xi Victoria Lin,Xian Li,James Cross,Sebastian Riedel,Mikel Artetxe",12,69,0,"https://www.semanticscholar.org/paper/c08c2fd7b269bd9d6c1162adc3b059cdf21d40a6"
"265ebfc1074c73917233dbecad802c0c64921a1c",3,"One does not fit all! On the Complementarity of Vision Encoders for Vision and Language Tasks","This work evaluates whether the information stored within different VEs is complementary, i.e. if providing the model with features from multiple VEs can improve the performance on a target task, and suggests that diverse VEs complement each other, resulting in improved downstream V+L task performance.","ArXiv",2022,"Gregor Geigle,Chen Cecilia Liu,Jonas Pfeiffer,Iryna Gurevych",0,41,0,"https://www.semanticscholar.org/paper/265ebfc1074c73917233dbecad802c0c64921a1c"
"8f248b5476666e700390f7f8ff6ca923f97d726c",3,"Advancing protein language models with linguistics: a roadmap for improved interpretability","It is argued that guidance drawn from linguistics, a field specialized in analytical rule extraction from natural language data, can aid with building more interpretable protein LMs that have learned relevant domain-specific rules.","ArXiv",2022,"Mai Ha Vu,R. Akbar,Philippe A. Robert,B. Swiatczak,V. Greiff,G. K. Sandve,Dag Trygve Tryslew Haug",3,137,0,"https://www.semanticscholar.org/paper/8f248b5476666e700390f7f8ff6ca923f97d726c"
"19e2f3a1e0c3b8340c14cb83e9ca6878a2598852",2,"IT5: Large-scale Text-to-text Pretraining for Italian Language Understanding and Generation","The monolingual IT5 models are found to provide the best scale-to-performance ratio across tested models, consistently outperforming their multilingual counterparts and setting a new state-of-the-art for most Italian conditional language generation tasks.","ArXiv",2022,"Gabriele Sarti,M. Nissim",6,40,2,"https://www.semanticscholar.org/paper/19e2f3a1e0c3b8340c14cb83e9ca6878a2598852"
"75214f960f82a0ed7fcf6fc0cd70b8d8f1847f8a",2,"Single Model Ensemble for Subword Regularized Models in Low-Resource Machine Translation","An inference strategy that approximates the marginalized likelihood by using multiple segmentations including the most plausible segmentation and several sampled segmentations that improves the performance of models trained with subword regularization in low-resource machine translation tasks.","Findings",2022,"Sho Takase,Tatsuya Hiraoka,Naoaki Okazaki",1,16,0,"https://www.semanticscholar.org/paper/75214f960f82a0ed7fcf6fc0cd70b8d8f1847f8a"
"d725c41b8e0516d0cf84d8fbd25eb7fc01a47342",2,"A Primer on Pretrained Multilingual Language Models","A review of the existing literature covering the above broad areas of research pertaining to MLLMs and some promising directions of future research are recommended.","ArXiv",2021,"Sumanth Doddapaneni,Gowtham Ramesh,Anoop Kunchukuttan,Pratyush Kumar,Mitesh M. Khapra",17,138,3,"https://www.semanticscholar.org/paper/d725c41b8e0516d0cf84d8fbd25eb7fc01a47342"
"bc39d16c108057e062ad6f1d0e8154df52cafc6a",2,"CMU’s Machine Translation System for IWSLT 2019","Block Multitask Learning (BMTL) is presented, a novel NMT architecture that predicts multiple targets of different granularities simulta- neously, removing the need to search for the optimal subword segmentation strategy.","International Workshop on Spoken Language Translation",2019,"Tejas Srinivasan,Ramon Sanabria,Florian Metze",3,31,0,"https://www.semanticscholar.org/paper/bc39d16c108057e062ad6f1d0e8154df52cafc6a"
"fec6def294027a2ce9094267ce7b7d57f78daf74",2,"Multitask Learning For Different Subword Segmentations In Neural Machine Translation","Block Multitask Learning (BMTL), a novel NMT architecture that predicts multiple targets of different granularities simultaneously, removing the need to search for the optimal segmentation strategy, is presented.","International Workshop on Spoken Language Translation",2019,"Tejas Srinivasan,Ramon Sanabria,Florian Metze",3,32,0,"https://www.semanticscholar.org/paper/fec6def294027a2ce9094267ce7b7d57f78daf74"
"debb3877b778eeb8689729d37e2b90f9f000d877",2,"Neural Machine Translation with Imbalanced Classes","This work casts neural machine translation as a classification task in an autoregressive setting and analyzes the limitations of both classification and autoregression components, and investigates the effect of class imbalance on NMT.","ArXiv",2020,"Thamme Gowda,Jonathan May",3,32,0,"https://www.semanticscholar.org/paper/debb3877b778eeb8689729d37e2b90f9f000d877"
"e5f6506f9332fcdb574f13a791e4f3c42b80ca90",2,"Demystifying Neural Language Models' Insensitivity to Word-Order","The insensitivity of natural language models to word-order is investigated by quantifying perturbations and analysing their effect on neural models’ performance on language understanding tasks in GLUE benchmark and it is found that neural language models — pretrained and non-pretrained Transformers, LSTMs, and Convolutional architectures — require local ordering more than the global ordering of tokens.","ArXiv",2021,"Louis Clouâtre,Prasanna Parthasarathi,A. Zouaq,Sarath Chandar",9,72,1,"https://www.semanticscholar.org/paper/e5f6506f9332fcdb574f13a791e4f3c42b80ca90"
"dca4128a33ca22c02031b5c0c28548a0df022d80",2,"BanglaBERT: Combating Embedding Barrier in Multilingual Models for Low-Resource Language Understanding","The Embedding Barrier is introduced, a phenomenon that limits the monolingual performance of multilingual models on low-resource languages having unique typologies and a straightforward solution by transcribing languages to a common script is proposed, which can effectively improve the performance of a multilingual model for the Bangla language.","",2021,"Abhik Bhattacharjee,Tahmid Hasan,Kazi Samin,Md. Saiful Islam,M. S. Rahman,Anindya Iqbal,Rifat Shahriyar",6,56,0,"https://www.semanticscholar.org/paper/dca4128a33ca22c02031b5c0c28548a0df022d80"
"a20a802839d72bee1c85f4a1cb77addadacb2179",2,"Specializing Multilingual Language Models: An Empirical Study","These evaluations on part-of-speech tagging, universal dependency parsing, and named entity recognition in nine diverse low-resource languages uphold the viability of these approaches while raising new questions around how to optimally adapt multilingual models to low- resource settings.","MRL",2021,"Ethan C. Chau,Noah A. Smith",10,72,0,"https://www.semanticscholar.org/paper/a20a802839d72bee1c85f4a1cb77addadacb2179"
"31852f9fc732c0868af12d631c72693702d80521",2,"Text Data Augmentation for Deep Learning","The major motifs of Data Augmentation are summarized into strengthening local decision boundaries, brute force training, causality and counterfactual examples, and the distinction between meaning and form.","Journal of Big Data",2021,"Connor Shorten,T. Khoshgoftaar,B. Furht",62,125,1,"https://www.semanticscholar.org/paper/31852f9fc732c0868af12d631c72693702d80521"
"91c3f9ed60a383f97a8c38f1e6a28a0e9be232fa",2,"Local Structure Matters Most: Perturbation Study in NLU","It is empirically shown that neural models, invariant of their inductive biases, pretraining scheme, or the choice of tokenization, mostly rely on the local structure of text to build understanding and make limited use of the global structure.","Findings",2021,"Louis Clouâtre,Prasanna Parthasarathi,A. Zouaq,Sarath Chandar",4,70,0,"https://www.semanticscholar.org/paper/91c3f9ed60a383f97a8c38f1e6a28a0e9be232fa"
"9933a5af7895354087baf6c96b64dc8a8973eaed",2,"Perceiver IO: A General Architecture for Structured Inputs & Outputs","The primary focus of this work is generality, rather than speed on images, and Perceiver IO uses comparable FLOPs to attention-based image classiﬁcation models, especially for the more compact conﬂguration B pretrained on JFT.","International Conference on Learning Representations",2021,"Andrew Jaegle,Sebastian Borgeaud,Jean-Baptiste Alayrac,Carl Doersch,Catalin Ionescu,David Ding,Skanda Koppula,Andrew Brock,Evan Shelhamer,Olivier J. H'enaff,M. Botvinick,A. Zisserman,Oriol Vinyals,João Carreira",171,105,26,"https://www.semanticscholar.org/paper/9933a5af7895354087baf6c96b64dc8a8973eaed"
"231e768f0cd280faa0f725bb353262cb4fed08d1",2,"Hierarchical Transformers Are More Efficient Language Models","Hourglass is a hierarchical Transformer language model that sets new state-of-the-art for Transformer models on the ImageNet32 generation task and improves language modeling efﬁciency on the widely studied enwik8 benchmark.","NAACL-HLT",2021,"Piotr Nawrot,Szymon Tworkowski,Michal Tyrolski,Lukasz Kaiser,Yuhuai Wu,Christian Szegedy,H. Michalewski",13,38,1,"https://www.semanticscholar.org/paper/231e768f0cd280faa0f725bb353262cb4fed08d1"
"7e3081b0d698f8abf16dee626d782f3339482fe7",2,"An Assessment of the Impact of OCR Noise on Language Models","It is found that OCR noise poses a significant obstacle to language modelling, with language models increasingly diverging from their noiseless targets as OCR quality lowers, and simpler models including PPMI and Word2Vec consistently outperform transformer-based models in this respect.","International Conference on Agents and Artificial Intelligence",2022,"Konstantin Todorov,Giovanni Colavizza",1,51,0,"https://www.semanticscholar.org/paper/7e3081b0d698f8abf16dee626d782f3339482fe7"
"54123c8de8ecacb30ae2e9fb8c4635f4030965b5",2,"MockingBERT: A Method for Retroactively Adding Resilience to NLP Models","A novel method of retroactively adding resilience to misspellings to transformer-based NLP models without the need for re-training of the original NLP model is proposed, which significantly reduces the cost needed to evaluate a model’s resilience to adversarial attacks.","International Conference on Computational Linguistics",2022,"Jan Jezabek,A. Singh",0,26,0,"https://www.semanticscholar.org/paper/54123c8de8ecacb30ae2e9fb8c4635f4030965b5"
"110250df2a6ca0e0e609eaa800a21c17abeedd77",2,"NLP for Language Varieties of Italy: Challenges and the Path Forward","","ArXiv",2022,"Alan Ramponi",1,85,0,"https://www.semanticscholar.org/paper/110250df2a6ca0e0e609eaa800a21c17abeedd77"
"9a5b2dc77bda19759df8481aaf283da353ac7e77",2,"Local Structure Matters Most in Most Languages","This work replicates a study on the importance of local structure, and the relative unimportance of global structure, in a multilingual setting and finds that the phenomenon observed on the English language broadly translates to over 120 languages, with a few caveats.","AACL",2022,"Louis Clouâtre,Prasanna Parthasarathi,A. Zouaq,Sarath Chandar",0,37,0,"https://www.semanticscholar.org/paper/9a5b2dc77bda19759df8481aaf283da353ac7e77"
"e541fb54b8b9f2b4d8253f678a28830cd4f52d86",2,"A Survey of Text Representation Methods and Their Genealogy","This work contributes threefold to this lack of compilation, composition, and systematization by providing a survey of current approaches, arranging them in a genealogy, and conceptualizing a taxonomy of text representation methods to examine and explain the state-of-the-art.","IEEE Access",2022,"Philipp Siebers,Christian Janiesch,Patrick Zschech",0,104,0,"https://www.semanticscholar.org/paper/e541fb54b8b9f2b4d8253f678a28830cd4f52d86"
"134e4d72e23bca51e290db171d063989883020f4",2,"Layer or Representation Space: What Makes BERT-based Evaluation Metrics Robust?","It is shown that an embedding-based metric that has the highest correlation with human evaluations on a standard benchmark can have the lowest correlation if the amount of input noise or unknown tokens increases, and the highest robustness is achieved when using character-level embeddings, instead of token-based embeddments, from the first layer of the pretrained model.","International Conference on Computational Linguistics",2022,"Doan Nam Long Vu,N. Moosavi,Steffen Eger",2,28,0,"https://www.semanticscholar.org/paper/134e4d72e23bca51e290db171d063989883020f4"
"2ffbe6040369a82d5a003c2bb835e221c9d2f896",2,"How Suitable Are Subword Segmentation Strategies for Translating Non-Concatenative Morphology?","It is found that learning to analyse and generate morphologically complex surface representations is still challenging, especially for nonconcatenative morphological phenomena like reduplication or vowel harmony and for rare word stems.","Conference on Empirical Methods in Natural Language Processing",2021,"Chantal Amrhein,Rico Sennrich",8,50,1,"https://www.semanticscholar.org/paper/2ffbe6040369a82d5a003c2bb835e221c9d2f896"
"7cb4b8406255d0f8115afa23d8efea1bb780cfb8",2,"On the Compatibility of Tokenizations Across Languages","It is shown that the compatibility measure proposed allows the system designer to create vocabularies across languages that are compatible – a desideratum that so far has been neglected in multilingual models.","",2021,"Antonis Maronikolakis,Philipp Dufter,Hinrich Schütze",0,39,0,"https://www.semanticscholar.org/paper/7cb4b8406255d0f8115afa23d8efea1bb780cfb8"
"3fdc5601bc3294c274c5fb8e0fa7efc636c00ff2",2,"DIRE and its Data: Neural Decompiled Variable Renamings with Respect to Software Class","This work investigates how data provenance and the quality of training data affect performance, and how well, if at all, trained models generalize across software domains, and evaluates DIRE’s overall performance without respect to data quality.","ACM Transactions on Software Engineering and Methodology",2022,"Luke Dramko,Jeremy Lacomis,Pengcheng Yin,Edward J. Schwartz,Miltiadis Allamanis,Graham Neubig,Bogdan Vasilescu,Claire Le Goues",0,58,0,"https://www.semanticscholar.org/paper/3fdc5601bc3294c274c5fb8e0fa7efc636c00ff2"
"e4750f7b56003fe8d2dcc750f91ddcbd7e9b82c7",2,"Checks and Strategies for Enabling Code-Switched Machine Translation","This work explores multilingual NMT models’ ability to handle code-switched text, and proposes checks to measure switching capability and investigates simple and effective data augmentation methods that can enhance an NMT model’s ability to support code- Switched text.","ArXiv",2022,"Thamme Gowda,Mozhdeh Gheini,Jonathan May",1,45,0,"https://www.semanticscholar.org/paper/e4750f7b56003fe8d2dcc750f91ddcbd7e9b82c7"
"9d83941a205e31d394f614424cdc553cea9e35f9",2,"Tackling Low-Resourced Sign Language Translation: UPC at WMT-SLT 22","This paper describes the system developed at the Universitat Politècnica de Catalunya for the Workshop on Machine Translation 2022 Sign Language Translation Task, in particular, for the sign-to-text direction using a Transformer model implemented with the Fairseq modeling toolkit.","ArXiv",2022,"Laia Tarrés,Gerard I. Gállego,Xavier Giró-i-Nieto,Jordi Torres",1,31,1,"https://www.semanticscholar.org/paper/9d83941a205e31d394f614424cdc553cea9e35f9"
"8a1c54f6e2c5f1453fddb9f15e769a099286f677",2,"Domain Adaptation and Multi-Domain Adaptation for Neural Machine Translation: A Survey","This work surveys approaches to domain adaptation for NMT, particularly where a system may need to translate across multiple domains, and divides techniques into those revolving around data selection or generation, model architecture, parameter adaptation procedure, and inference procedure.","Journal of Artificial Intelligence Research",2021,"Danielle Saunders",20,366,0,"https://www.semanticscholar.org/paper/8a1c54f6e2c5f1453fddb9f15e769a099286f677"
"b162638cd42b65e6add199b0b34f1b375070fc7c",2,"Multilingual Auxiliary Tasks Training: Bridging the Gap between Languages for Zero-Shot Transfer of Hate Speech Detection Models","It is shown how hate speech detection models benefit from a cross-lingual knowledge proxy brought by auxiliary tasks fine-tuning and highlight these tasks’ positive impact on bridging the hate speech linguistic and cultural gap between languages.","AACL/IJCNLP",2022,"Syrielle Montariol,Arij Riabi,Djamé Seddah",0,56,0,"https://www.semanticscholar.org/paper/b162638cd42b65e6add199b0b34f1b375070fc7c"
"327f1561b544b0a3b9d8d5d0e6d82c2a5911fca9",2,"BLOOM: A 176B-Parameter Open-Access Multilingual Language Model","BLOOM is a 176B-parameter open-access language model designed and built thanks to a collaboration of hundreds of researchers and achieves competitive performance on a wide variety of benchmarks, with stronger results after undergoing multitask prompted finetuning.","ArXiv",2022,"Teven Le Scao,Angela Fan,Christopher Akiki,Elizabeth-Jane Pavlick,Suzana Ili'c,Daniel Hesslow,Roman Castagn'e,A. Luccioni,Franccois Yvon,Matthias Gallé,J. Tow,Alexander M. Rush,Stella Rose Biderman,Albert Webson,Pawan Sasanka Ammanamanchi,Thomas Wang,Benoît Sagot,Niklas Muennighoff,Albert Villanova del Moral,Olatunji Ruwase,Rachel Bawden,Stas Bekman,Angelina McMillan-Major,Iz Beltagy,Huu Nguyen,Lucile Saulnier,Samson Tan,Pedro Ortiz Suarez,Victor Sanh,Hugo Laurenccon,Yacine Jernite,Julien Launay,Margaret Mitchell,Colin Raffel,Aaron Gokaslan,Adi Simhi,Aitor Soroa Etxabe,Alham Fikri Aji,Amit Alfassy,Anna Rogers,Ariel Kreisberg Nitzav,Canwen Xu,Chenghao Mou,Chris C. Emezue,Christopher Klamm,Colin Leong,Daniel Alexander van Strien,David Ifeoluwa Adelani,Dragomir R. Radev,Eduardo G. Ponferrada,Efrat Levkovizh,Ethan Kim,E. Natan,F. Toni,Gérard Dupont,Germán Kruszewski,Giada Pistilli,Hady ElSahar,Hamza Benyamina,Hieu Tran,Ian Yu,Idris Abdulmumin,Isaac Johnson,Itziar Gonzalez-Dios,Javier de la Rosa,Jenny Chim,Jesse Dodge,Jian Zhu,Jonathan Chang,Jorg Frohberg,Josephine L. Tobing,J. Bhattacharjee,Khalid Almubarak,Kimbo Chen,Kyle Lo,Leandro von Werra,Leon Weber,Long Phan,Loubna Ben Allal,Ludovic Tanguy,Manan Dey,M. Muñoz,Maraim Masoud,Mar'ia Grandury,Mario vSavsko,Max Huang,Maximin Coavoux,Mayank Singh,Mike Tian-Jian Jiang,Minh Chien Vu,M. A. Jauhar,Mustafa Ghaleb,Nishant Subramani,Nora Kassner,Nurulaqilla Khamis,Olivier Nguyen,Omar Espejel,Ona de Gibert,Paulo Villegas,Peter Henderson,Pierre Colombo,Priscilla Amuok,Quentin Lhoest,Rheza Harliman,Rishi Bommasani,R. L'opez,Rui Ribeiro,Salomey Osei,Sampo Pyysalo,Sebastian Nagel,Shamik Bose,Shamsuddeen Hassan Muhammad,Shanya Sharma,S. Longpre,Somaieh Nikpoor,Stanislav Silberberg,S. Pai,S. Zink,Tiago Timponi Torrent,Timo Schick,Tristan Thrush,V. Danchev,Vassilina Nikoulina,Veronika Laippala,Violette Lepercq,V. Prabhu,Zaid Alyafeai,Zeerak Talat,Arun Raja,Benjamin Heinzerling,Chenglei Si,Elizabeth Salesky,Sabrina J. Mielke,Wilson Y. Lee,Abheesht Sharma,Andrea Santilli,Antoine Chaffin,Arnaud Stiegler,Debajyoti Datta,Eliza Szczechla,Gunjan Chhablani,Han Wang,Harshit Pandey,Hendrik Strobelt,Jason Alan Fries,Jos Rozen,Leo Gao,Lintang Sutawika,M Saiful Bari,Maged S. Al-shaibani,Matteo Manica,Nihal V. Nayak,Ryan Teehan,Samuel Albanie,Sheng Shen,Srulik Ben-David,Stephen H. Bach,Taewoon Kim,T. Bers,Thibault Févry,Trishala Neeraj,Urmish Thakker,Vikas Raunak,Xiang Tang,Zheng Xin Yong,Zhiqing Sun,Shaked Brody,Y. Uri,Hadar Tojarieh,Adam Roberts,Hyung Won Chung,Jaesung Tae,Jason Phang,Ofir Press,Conglong Li,D. Narayanan,Hatim Bourfoune,J. Casper,Jeff Rasley,Max Ryabinin,Mayank Mishra,Minjia Zhang,M. Shoeybi,Myriam Peyrounette,N. Patry,Nouamane Tazi,Omar Sanseviero,Patrick von Platen,Pierre Cornette,Pierre Franccois Lavall'ee,R. Lacroix,Samyam Rajbhandari,Sanchit Gandhi,Shaden Smith,S. Requena,Suraj Patil,Tim Dettmers,Ahmed Baruwa,Amanpreet Singh,Anastasia Cheveleva,Anne-Laure Ligozat,Arjun Subramonian,Aur'elie N'ev'eol,Charles Lovering,Daniel H Garrette,D. Tunuguntla,Ehud Reiter,Ekaterina Taktasheva,E. Voloshina,Eli Bogdanov,Genta Indra Winata,Hailey Schoelkopf,Jan-Christoph Kalo,Jekaterina Novikova,J. Forde,Jordan Clive,Jungo Kasai,Ken Kawamura,Liam Hazan,Marine Carpuat,Miruna Clinciu,Najoung Kim,Newton Cheng,Oleg Serikov,Omer Antverg,Oskar van der Wal,Rui Zhang,Ruochen Zhang,Sebastian Gehrmann,S. Pais,Tatiana Shavrina,Thomas Scialom,Tian Yun,Tomasz Limisiewicz,Verena Rieser,Vitaly Protasov,V. Mikhailov,Yada Pruksachatkun,Yonatan Belinkov,Zachary Bamberger,Zdenvek Kasner,Alice Rueda,Amanda Pestana,A. Feizpour,Ammar Khan,Amy Faranak,A. Santos,A. Hevia,Antigona Unldreaj,Arash Aghagol,Arezoo Abdollahi,A. Tammour,Azadeh HajiHosseini,Bahareh Behroozi,B. Ajibade,B. Saxena,Carlos Muñoz Ferrandis,Danish Contractor,D. Lansky,Davis David,Douwe Kiela,D. A. Nguyen,Edward Tan,Emily Baylor,Ezinwanne Ozoani,Fatim T Mirza,Frankline Ononiwu,Habib Rezanejad,H.A. Jones,Indrani Bhattacharya,Irene Solaiman,Irina Sedenko,I. Nejadgholi,J. Passmore,Joshua Seltzer,Julio Bonis Sanz,Karen Fort,L. Dutra,Mairon Samagaio,Maraim Elbadri,M. Mieskes,Marissa Gerchick,Martha Akinlolu,Michael McKenna,Mike Qiu,M. Ghauri,Mykola Burynok,Nafis Abrar,Nazneen Rajani,Nour Elkott,N. Fahmy,O. Samuel,Ran An,R. Kromann,Ryan Hao,S. Alizadeh,Sarmad Shubber,Silas L. Wang,Sourav Roy,S. Viguier,Thanh-Cong Le,Tobi Oyebade,T. Le,Yoyo Yang,Z. Nguyen,Abhinav Ramesh Kashyap,Alfredo Palasciano,A. Callahan,Anima Shukla,Antonio Miranda-Escalada,A. Singh,Benjamin Beilharz,Bo Wang,C. Brito,Chenxi Zhou,Chirag Jain,Chuxin Xu,Clémentine Fourrier,Daniel Le'on Perin'an,Daniel Molano,Dian Yu,Enrique Manjavacas,Fabio Barth,Florian Fuhrimann,Gabriel Altay,Giyaseddin Bayrak,Gully A. Burns,Helena U. Vrabec,I. Bello,Isha Dash,J. Kang,John Giorgi,J. Golde,J. Posada,Karthi Sivaraman,Lokesh Bulchandani,Lu Liu,Luisa Shinzato,Madeleine Hahn de Bykhovetz,Maiko Takeuchi,Marc Pàmies,M. A. Castillo,Marianna Nezhurina,Mario Sanger,M. Samwald,Michael Cullan,Michael Weinberg,M. Wolf,Mina Mihaljcic,Minna Liu,M. Freidank,Myungsun Kang,Natasha Seelam,N. Dahlberg,N. Broad,N. Muellner,Pascale Fung,Patricia Haller,R. Chandrasekhar,R. Eisenberg,Robert Martin,Rodrigo L. Canalli,Rosaline Su,Ruisi Su,Samuel Cahyawijaya,Samuele Garda,Shlok S Deshmukh,Shubhanshu Mishra,Sid Kiblawi,Simon Ott,Sinee Sang-aroonsiri,Srishti Kumar,Stefan Schweter,S. Bharati,T. A. Laud,Th'eo Gigant,Tomoya Kainuma,Wojciech Kusa,Yanis Labrak,Yashasvi Bajaj,Y. Venkatraman,Yifan Xu,Ying Xu,Yun-chao Xu,Z. Tan,Zhongli Xie,Zifan Ye,M. Bras,Younes Belkada,Thomas Wolf",35,157,6,"https://www.semanticscholar.org/paper/327f1561b544b0a3b9d8d5d0e6d82c2a5911fca9"
"8969ea3d254e149aebcfd1ffc8f46910d7cb160e",2,"Uncontrolled Lexical Exposure Leads to Overestimation of Compositional Generalization in Pretrained Models","It is argued that exposure to pre-training data may break distributional control across training and test to gauge compositional generalization, where certain lexical items only occur in limited contexts during training.","ArXiv",2022,"Najoung Kim,Tal Linzen,P. Smolensky",1,51,0,"https://www.semanticscholar.org/paper/8969ea3d254e149aebcfd1ffc8f46910d7cb160e"
"cde3d57c8f38e5dfb50edbb31faf02c23f1507fe",2,"Interpreting Character Embeddings With Perceptual Representations: The Case of Shape, Sound, and Color","This cross-lingual analysis shows that textual character representations correlate strongly with sound representations for languages using an alphabetic script, while shape correlates with featural scripts.","Annual Meeting of the Association for Computational Linguistics",2022,"Sidsel Boldsen,Manex Agirrezabal,Nora Hollenstein",0,77,0,"https://www.semanticscholar.org/paper/cde3d57c8f38e5dfb50edbb31faf02c23f1507fe"
"ae7fc32df9401a86353185515f4fd5e2020ac922",1,"MutFormer: A context-dependent transformer-based model to predict pathogenic missense mutations","This study introduces MutFormer, a transformer-based model for the prediction of pathogenic missense mutations, using reference and mutated amino acid sequences from the human genome as the features, and shows that MutFormer outperforms a variety of existing tools in pathogenicity prediction.","ArXiv",2021,"Theodore Jiang,Li Fang,Kai Wang",4,40,1,"https://www.semanticscholar.org/paper/ae7fc32df9401a86353185515f4fd5e2020ac922"
"e873ddaf58ff92ae0492983cf57221fb25837f4e",1,"Strategies in subword tokenization: humans vs. algorithms","A new method to an- 010 alyze subword segmentation strategies relying on a spatial analysis of the distribution of sub- 012 words’ lengths is proposed, which shows that humans tend to balance creativity and consistency, while algorithms tend to be either strongly biased or inconsistent.","",2021,"",0,13,0,"https://www.semanticscholar.org/paper/e873ddaf58ff92ae0492983cf57221fb25837f4e"
