"id","score","title","summary","venue","year","authors","citationCount","referenceCount","influentialCitationCount","url"
"063d9fa4861356500219b7e81d5a654aa921da6f",1,"A Few Thousand Translations Go a Long Way! Leveraging Pre-trained Models for African News Translation","It is demonstrated that the most effective strategy for transferring both additional languages and additional domains is to leverage small quantities of high-quality translation data to fine-tune large pre-trained models.","North American Chapter of the Association for Computational Linguistics",2022,"David Ifeoluwa Adelani,Jesujoba Oluwadara Alabi,Angela Fan,Julia Kreutzer,Xiaoyu Shen,Machel Reid,Dana Ruiter,D. Klakow,Peter Nabende,Ernie Chang,T. Gwadabe,Freshia Sackey,Bonaventure F. P. Dossou,Chris C. Emezue,Colin Leong,Michael Beukman,Shamsuddeen Hassan Muhammad,Guyo Dub Jarso,Oreen Yousuf,Andre Niyongabo Rubungo,Gilles Hacheme,Eric Peter Wairagala,Muhammad Umair Nasir,Benjamin Ayoade Ajibade,T. Ajayi,Yvonne Wambui Gitau,Jade Z. Abbott,Mohamed Ahmed,Millicent A. Ochieng,Anuoluwapo Aremu,Perez Ogayo,Jonathan Mukiibi,Fatoumata Kabore,Godson Kalipe,Derguene Mbaye,A. Tapo,V. M. Koagne,Edwin Munkoh-Buabeng,Valencia Wagner,Idris Abdulmumin,A. Awokoya,Happy Buzaaba,Blessing K. Sibanda,Andiswa Bukula,Sam Manthalu",11,68,0,"https://www.semanticscholar.org/paper/063d9fa4861356500219b7e81d5a654aa921da6f"
"645b10b7802a035e034488e3640fc0bc415de34c",1,"UL2: Unifying Language Learning Paradigms","By scaling the model up to 20B parameters, this paper achieves SOTA performance on 50 well-established supervised NLP tasks ranging from language generation, language understanding, text classiﬁcation, question answering, commonsense reasoning, long text reasoning, structured knowledge grounding and information retrieval.","",2022,"Yi Tay,M. Dehghani,V. Tran,Xavier García,Jason Wei,Xuezhi Wang,Hyung Won Chung,Dara Bahri,Tal Schuster,Huaixiu Zheng,Denny Zhou,N. Houlsby,Donald Metzler",0,125,0,"https://www.semanticscholar.org/paper/645b10b7802a035e034488e3640fc0bc415de34c"
"f40aeae3e522ada1f6a9f326841b01ef5c8657b6",1,"Unifying Language Learning Paradigms","UL2 achieves SOTA performance on 50 well-established supervised NLP tasks ranging from language generation, language understanding, text classiﬁcation, question answering, commonsense reasoning, long text reasoning, structured knowledge grounding and information retrieval.","ArXiv",2022,"Yi Tay,M. Dehghani,V. Tran,Xavier García,Dara Bahri,Tal Schuster,Huaixiu Zheng,N. Houlsby,Donald Metzler",31,113,4,"https://www.semanticscholar.org/paper/f40aeae3e522ada1f6a9f326841b01ef5c8657b6"
"32afdb07021fda775ceaedd231c58bfed0aa980a",1,"Automated Crossword Solving","The Berkeley Crossword Solver is presented, a state-of-the-art approach for automatically solving crossword puzzles that improves exact puzzle accuracy from 57% to 82% on crosswords from The New York Times and obtains 99.9% letter accuracy on themeless puzzles.","Annual Meeting of the Association for Computational Linguistics",2022,"Eric Wallace,Nicholas Tomlin,Albert Xu,Kevin Yang,Eshaan Pathak,Matthew Ginsberg,D. Klein",2,29,1,"https://www.semanticscholar.org/paper/32afdb07021fda775ceaedd231c58bfed0aa980a"
"a766ef0678aade6a9798552618819cf4d0fac406",1,"TEVR: Improving Speech Recognition by Token Entropy Variance Reduction","TEVR, a speech recognition model designed to minimize the variation in token entropy w.r.t. to the language model, is presented and it is shown that on CommonVoice German, TEVR scores a very competitive 3 .","ArXiv",2022,"Hajo N. Krabbenhöft,E. Barth",0,21,0,"https://www.semanticscholar.org/paper/a766ef0678aade6a9798552618819cf4d0fac406"
"b308511ac52e1c2da915d1e55d5246dfdb4cbe28",1,"Romanian Question Answering Using Transformer Based Neural Networks","This work presents experiments evaluated on the XQuAD-ro question answering dataset that has been recently published based on the translation of the SQuAD dataset into Romanian, and shows that fine-tuning the model with the addition of the Romanian translation slightly increases the evaluation metrics.","Studia Universitatis Babeș-Bolyai Informatica",2022,"Bogdan-Alexandru Diaconu,Beáta Lázár-Lőrincz",0,5,0,"https://www.semanticscholar.org/paper/b308511ac52e1c2da915d1e55d5246dfdb4cbe28"
"2ef60a4ea4ea53056be811ff55679eb59fb4b586",1,"Confident Adaptive Language Modeling","This work introduces Conﬁdent Adaptive Language Modeling (CALM), a framework for dynamically allocating different amounts of compute per input and generation timestep, and demonstrates the efﬂcacy of the framework in reducing compute—speedup of up to × 3 —while provably maintaining high performance.","ArXiv",2022,"Tal Schuster,Adam Fisch,Jai Gupta,M. Dehghani,Dara Bahri,V. Tran,Yi Tay,Donald Metzler",8,89,0,"https://www.semanticscholar.org/paper/2ef60a4ea4ea53056be811ff55679eb59fb4b586"
"00d9a73c54053a32e2aba92b53fc3e6bc71d3238",1,"Sequence to sequence pretraining for a less-resourced Slovenian language","Two diﬀerent sized T5-type sequence to sequence models for morphologically rich Slovene language with much less resources are trained and analyzed, which mostly lag behind the monolingual Slovene SloBERTa model but are useful for the generative tasks.","",2022,"Matej Ulvcar,Marko Robnik-vSikonja",1,44,1,"https://www.semanticscholar.org/paper/00d9a73c54053a32e2aba92b53fc3e6bc71d3238"
"a806041621acb5cf648fc780f1ff14939aa3a721",1,"How Much Does Lookahead Matter for Disambiguation? Partial Arabic Diacritization Case Study","It is found that the partial diacritizer improves translation quality compared either to their total absence or to random selection, and the benefit of knowing the text that follows the word in focus toward the restoration of short vowels during reading is studied.","Computational Linguistics",2022,"Saeed Esmail,Kfir Bar,N. Dershowitz",0,57,0,"https://www.semanticscholar.org/paper/a806041621acb5cf648fc780f1ff14939aa3a721"
"e4437293a703fcf282bf1b38bf7900ed8ca711bb",1,"Training a T5 Using Lab-sized Resources","This paper presents var-ious techniques for making it possible to train a large language model using resources that a modest research lab might have, and train it in a reasonable amount of time.","ArXiv",2022,"Manuel R. Ciosici,Leon Derczynski",0,29,0,"https://www.semanticscholar.org/paper/e4437293a703fcf282bf1b38bf7900ed8ca711bb"
"9fc5878d49c41beb12b62032b0afe9a8501fe9db",1,"PaLI: A Jointly-Scaled Multilingual Language-Image Model","PaLI achieves state-of-the-art in multiple vision and language tasks, while retaining a simple, modular, and scalable design.","ArXiv",2022,"Xi Chen,Xiao Wang,Soravit Changpinyo,A. Piergiovanni,Piotr Padlewski,Daniel M. Salz,Sebastian Goodman,Adam Grycner,Basil Mustafa,L. Beyer,Alexander Kolesnikov,J. Puigcerver,Nan Ding,Keran Rong,Hassan Akbari,Gaurav Mishra,Linting Xue,Ashish V. Thapliyal,James Bradbury,Weicheng Kuo,Mojtaba Seyedhosseini,Chao Jia,Burcu Karagol Ayan,C. Riquelme,A. Steiner,A. Angelova,Xiaohua Zhai,N. Houlsby,Radu Soricut",29,92,5,"https://www.semanticscholar.org/paper/9fc5878d49c41beb12b62032b0afe9a8501fe9db"
"2a8aac78df5e1e9658a02d381662ed26c6577713",1,"Disease diagnostic method based on cascade backbone network for apple leaf disease classification","This paper is the first to introduce Transformer into apple leaf disease identification, and the results are promising.","Frontiers in Plant Science",2022,"Xing Sheng,Fengyun Wang,Huaijun Ruan,Yangyang Fan,Jiye Zheng,Yangyang Zhang,Chen Lyu",0,25,0,"https://www.semanticscholar.org/paper/2a8aac78df5e1e9658a02d381662ed26c6577713"
"595cc15b9db4e985b30a2e175399a38c021d4ce7",1,"Look Ma, Only 400 Samples! Revisiting the Effectiveness of Automatic N-Gram Rule Generation for Spelling Normalization in Filipino","An N-Gram + Damerau-Levenshtein distance model with automatic rule extraction that outperforms other deep learning approaches in terms of accuracy and edit distance and is easily interpretable over more complex deep learning models in settings where data is unavailable.","ArXiv",2022,"Lorenzo Jaime Yu Flores",0,24,0,"https://www.semanticscholar.org/paper/595cc15b9db4e985b30a2e175399a38c021d4ce7"
"539b6862f7e6ce9f98043f00a4ccdb4a9ff8de72",1,"Non-Axiomatic Term Logic: A Computational Theory of Cognitive Symbolic Reasoning","Non-Axiomatic Term Logic is presented as a theoretical computational framework of humanlike symbolic reasoning in artiﬁcial intelligence and positions the proposed approach in the phylogeny and the literature of logic.","Transactions of the Japanese society for artificial intelligence",2022,"Kotaro Funakoshi",0,58,0,"https://www.semanticscholar.org/paper/539b6862f7e6ce9f98043f00a4ccdb4a9ff8de72"
"5484d228bfc50efbac6e86677bc2ec2ee4ede1a6",1,"Scaling Instruction-Finetuned Language Models","This result shows that instruction and UL2 continued pre-training are complementary compute-eﬃcient methods to improve the performance of language models without increasing model scale.","ArXiv",2022,"Hyung Won Chung,Le Hou,S. Longpre,Barret Zoph,Yi Tay,W. Fedus,Eric Li,Xuezhi Wang,M. Dehghani,Siddhartha Brahma,Albert Webson,S. Gu,Zhuyun Dai,Mirac Suzgun,Xinyun Chen,Aakanksha Chowdhery,Dasha Valter,Sharan Narang,Gaurav Mishra,A. Yu,Vincent Zhao,Yanping Huang,Andrew M. Dai,Hongkun Yu,Slav Petrov,E. Chi,J. Dean,Jacob Devlin,Adam Roberts,Denny Zhou,Quoc Le,Jason Wei",14,104,2,"https://www.semanticscholar.org/paper/5484d228bfc50efbac6e86677bc2ec2ee4ede1a6"
"6eaa0aa5cc9d3eaa9f578a07fcaa1878cfd21cbc",1,"Graphemic Normalization of the Perso-Arabic Script","It is argued that better understanding and representation of Perso-Arabic script variation within regional orthographic traditions, where those are present, is crucial for further progress of modern computational NLP techniques, especially for languages with a paucity of resources.","ArXiv",2022,"R. Doctor,Alexander Gutkin,Cibu Johny,Brian Roark,R. Sproat",0,128,0,"https://www.semanticscholar.org/paper/6eaa0aa5cc9d3eaa9f578a07fcaa1878cfd21cbc"
"d2b1405ac8d17f8643ed1f8f7d801e9e406d8da6",1,"SLING: Sino Linguistic Evaluation of Large Language Models","","ArXiv",2022,"Yixiao Song,Kalpesh Krishna,R. Bhatt,Mohit Iyyer",0,61,0,"https://www.semanticscholar.org/paper/d2b1405ac8d17f8643ed1f8f7d801e9e406d8da6"
"5e786d47e3dc5ffa65ba8548ff67139a2764acf8",1,"T5lephone: Bridging Speech and Text Self-supervised Models for Spoken Language Understanding via Phoneme level T5","This work conducts extensive studies on how PLMs with different tokenization strategies affect spoken language understanding task including spoken question answering (SQA) and speech translation (ST) and creates T5lephone, a variant of T5 that is pretrained using phonemicized text.","ArXiv",2022,"Chan-Jan Hsu,Ho-Lam Chung,Hung-yi Lee,Yu Tsao",1,28,0,"https://www.semanticscholar.org/paper/5e786d47e3dc5ffa65ba8548ff67139a2764acf8"
"92302ab168429c7c3a8f699b35ba8302916c6e7c",1,"Bridging Speech and Textual Pre-trained Models with Unsupervised ASR","The experiments show that unsupervised ASR itself can improve the representations from speech self-supervised models, and it is shown as an efﬁcient connector between speech and textual pre-trained models, improv-ing the performances of different SLU tasks.","ArXiv",2022,"Jiatong Shi,Chan-Jan Hsu,Ho-Lam Chung,Dongji Gao,Paola García,Shinji Watanabe,Ann Lee,Hung-yi Lee",0,43,0,"https://www.semanticscholar.org/paper/92302ab168429c7c3a8f699b35ba8302916c6e7c"
"9dab4c20648cd4c7c6830e6274a95294b014aac9",1,"QAmeleon: Multilingual QA with Only 5 Examples","This approach uses a PLM to automatically generate multilingual data upon which QA models are trained, thus avoiding costly annotation and shows that few-shot prompt tuning for data synthesis scales across languages and is a viable alternative to large-scale annotation.","ArXiv",2022,"Priyanka Agrawal,Chris Alberti,Fantine Huot,Joshua Maynez,Ji Ma,Sebastian Ruder,Kuzman Ganchev,Dipanjan Das,Mirella Lapata",1,57,0,"https://www.semanticscholar.org/paper/9dab4c20648cd4c7c6830e6274a95294b014aac9"
"d50b9db750ded246bde13e2c263e341bcbd8a335",1,"A Benchmark and Dataset for Post-OCR text correction in Sanskrit","This work releases a post-OCR text correction dataset containing around 218,000 sentences, with 1.5 million words, from 30 different books of Sanskrit, and finds that the best-performing model, consisting of byte level tokenization in conjunction with phonetic encoding (Byt5+SLP1), yields a 23% point increase over the OCR output in terms of word and character error rates.","ArXiv",2022,"Ayush Maheshwari,Nikhil Singh,A. Krishna,Ganesh Ramakrishnan",1,25,0,"https://www.semanticscholar.org/paper/d50b9db750ded246bde13e2c263e341bcbd8a335"
"3af872a4bd314db9e7964876fee811823628f83f",1,"Text Normalization on Code-Mixed Twitter Text using Language Detection","The research shows that proposed method for text normalization still has problems related to language, either on identifying language or normalize a word, but the approach is using language detection module alongside with transformer model.","International Conference on Intelligent Computing",2022,"Rafi Dwi Rizqullah,I. Budi",0,10,0,"https://www.semanticscholar.org/paper/3af872a4bd314db9e7964876fee811823628f83f"
"be2df0fafa89b6355d1ff1336c10e0d4c8d27276",1,"The Massively Multilingual Natural Language Understanding 2022 (MMNLU-22) Workshop and Competition","A three-phase approach to address the limitations in NLU and help propel NLU technology to new heights is launched, a 52 language dataset is released, and the Massively Multilingual NLU 2022 Challenge is organized.","ArXiv",2022,"C. Hench,Charith S. Peris,Jack G. M. FitzGerald,Kay Rottmann",0,9,0,"https://www.semanticscholar.org/paper/be2df0fafa89b6355d1ff1336c10e0d4c8d27276"
"4aa09cba27a489ca02471fad011ea4854fc63cc1",1,"DAMP: Doubly Aligned Multilingual Parser for Task-Oriented Dialogue","This work shows that pretraining alignment objectives improve mul- 012 tilingual transfer while also reducing negative negative transfer to English, and introduces a strained optimization method to improve align- 015 ment using domain adversarial training.","ArXiv",2022,"William B. Held,Christopher Hidey,Fei Liu,Eric Zhu,Rahul Goel,Diyi Yang,Rushin Shah",0,45,0,"https://www.semanticscholar.org/paper/4aa09cba27a489ca02471fad011ea4854fc63cc1"
"d4c23dc85ea1eba2f863ff6ffbbb5e473e491ff4",1,"TRIP: Triangular Document-level Pre-training for Multilingual Language Models","In-depth analysis indicates that TRIP improves document-level machine translation and captures better document contexts in at least three characteristics: (i) tense consistency, (ii) noun consistency and (iii) conjunction presence.","ArXiv",2022,"Hongyuan Lu,Haoyang Huang,Shuming Ma,Dongdong Zhang,W. Lam,Furu Wei",0,47,0,"https://www.semanticscholar.org/paper/d4c23dc85ea1eba2f863ff6ffbbb5e473e491ff4"
"b1dad820853464b30c93b52366b32690ba4b99a6",1,"A Brief Overview of Universal Sentence Representation Methods: A Linguistic View","This survey summarizes the current universal sentence-embedding methods, categorizes them into four groups from a linguistic view, and ultimately analyzes their reported performance.","ACM Computing Surveys",2022,"Ruiqi Li,Xiang Zhao,M. Moens",2,162,0,"https://www.semanticscholar.org/paper/b1dad820853464b30c93b52366b32690ba4b99a6"
"91ea7176cc41f7b97867d483075df7886aa3dc33",1,"Practical Transformer-based Multilingual Text Classification","Results show that multilingual language models can outperform monolingual ones in some downstream tasks and target languages and that practical modifications such as task- and domain-adaptive pretraining and data augmentation can improve classification performance without the need for additional labeled data.","North American Chapter of the Association for Computational Linguistics",2021,"Cindy Wang,Michele Banko",7,42,0,"https://www.semanticscholar.org/paper/91ea7176cc41f7b97867d483075df7886aa3dc33"
"8484b4da1aff6460edbd2df78bf2f5e801569248",1,"GSI-UPM at IberLEF2021: Emotion Analysis of Spanish Tweets by Fine-tuning the XLM-RoBERTa Language Model","This work proposes the design and development of a fine-tuned neural language model (XLM-RoBERTa) to tackle an emotion classification task of Spanish tweets, categorizing each message into seven emotions.","IberLEF@SEPLN",2021,"D. Vera,Óscar Araque,C. Iglesias",1,20,0,"https://www.semanticscholar.org/paper/8484b4da1aff6460edbd2df78bf2f5e801569248"
"7e5133e41d5a06b8ad4bad7f2046ac73edf43e38",1,"TUDa at WMT21: Sentence-Level Direct Assessment with Adapters","This work focuses on utilizing massively multilingual language models which only partly cover the target languages during their pre-training phase and extends the model to new languages and unseen scripts using recent adapter-based methods and achieve on par performance or even surpass models pre-trained on the respective languages.","Conference on Machine Translation",2021,"Gregor Geigle,Jonas Stadtmüller,Wei Zhao,Jonas Pfeiffer,Steffen Eger",1,30,0,"https://www.semanticscholar.org/paper/7e5133e41d5a06b8ad4bad7f2046ac73edf43e38"
"892731fd37a1d38901b0c5bc68168d96f43bd5d0",1,"Monolingual Pre-trained Language Models for Tigrinya","This work pre-train three monolingual PLMs for Tigrinya on a newly compiled corpus, and compares the models with their multilingual counterparts on two downstream tasks, part-of-speech tagging and sentiment analysis, achieving significantly better results and establishing the state of the art.","",2021,"Fitsum Gaim,Wonsuk Yang,Jong C. Park",1,16,0,"https://www.semanticscholar.org/paper/892731fd37a1d38901b0c5bc68168d96f43bd5d0"
"6adc9c231d874ea358554b8680a6aaba4bd6c963",1,"MAD-G: Multilingual Adapter Generation for Efficient Cross-Lingual Transfer","MAD-G (Multilingual ADapter Generation), which contextually generates language adapters from language representations based on typological features, offers substantial benefits for low-resource languages, particularly on the NER task in low- resource African languages.","Conference on Empirical Methods in Natural Language Processing",2021,"Alan Ansell,E. Ponti,Jonas Pfeiffer,Sebastian Ruder,Goran Glavas,Ivan Vulic,A. Korhonen",26,40,2,"https://www.semanticscholar.org/paper/6adc9c231d874ea358554b8680a6aaba4bd6c963"
"22c8444eb4da5ae8d43829b127d5e7ee9950b151",1,"Crossing the Conversational Chasm: A Primer on Multilingual Task-Oriented Dialogue Systems","This work identifies two main challenges that combined hinder the faster progress in multilingual TOD: current state-of-the-art TOD models based on large pretrained neural language models are data hungry; at the same time data acquisition for TOD use cases is expensive and tedious.","ArXiv",2021,"E. Razumovskaia,Goran Glavas,Olga Majewska,A. Korhonen,Ivan Vulic",14,274,2,"https://www.semanticscholar.org/paper/22c8444eb4da5ae8d43829b127d5e7ee9950b151"
"64cc584aa9bafebbab0bc012e225563cf2873ecc",1,"Introduction to Neural Transfer Learning with Transformers for Social Science Text Analysis","This paper explains how Transformer-based models for transfer learning work, why they might be advantageous, and what their limitations are, and demonstrates the benefits these models can bring to textbased social science research.","",2021,"Sandra Wankmuller",2,241,0,"https://www.semanticscholar.org/paper/64cc584aa9bafebbab0bc012e225563cf2873ecc"
"a4ab1bd1501668e932c986725b33d065e4f0a233",1,"The Interplay of Variant, Size, and Task Type in Arabic Pre-trained Language Models","This paper builds three pre-trained language models across three variants of Arabic: Modern Standard Arabic, dialectal Arabic, and classical Arabic, in addition to a fourth language model which is pre- trained on a mix of the three.","Workshop on Arabic Natural Language Processing",2021,"Go Inoue,Bashar Alhafni,Nurpeiis Baimukan,Houda Bouamor,Nizar Habash",39,70,10,"https://www.semanticscholar.org/paper/a4ab1bd1501668e932c986725b33d065e4f0a233"
"7b99c51d562e33309a46601c846abbe72a65c6a4",1,"What to Pre-Train on? Efficient Intermediate Task Selection","This work provides a comprehensive comparison of different methods for efficiently identifying beneficial tasks for intermediate transfer learning, focusing on parameter and computationally efficient adapter settings, highlight different data-availability scenarios, and provide expense estimates for each method.","Conference on Empirical Methods in Natural Language Processing",2021,"Clifton Poth,Jonas Pfeiffer,Andreas Ruckl'e,Iryna Gurevych",38,92,4,"https://www.semanticscholar.org/paper/7b99c51d562e33309a46601c846abbe72a65c6a4"
"529edafa160a77901bec123cf8858e6c08f6cd06",1,"When does pretraining help?: assessing self-supervised learning for law and the CaseHOLD dataset of 53,000+ legal holdings","It is shown that domain pretraining may be warranted when the task exhibits sufficient similarity to the pretraining corpus: the level of performance increase in three legal tasks was directly tied to the domain specificity of the task.","International Conference on Artificial Intelligence and Law",2021,"Lucia Zheng,Neel Guha,Brandon R. Anderson,Peter Henderson,Daniel E. Ho",50,52,16,"https://www.semanticscholar.org/paper/529edafa160a77901bec123cf8858e6c08f6cd06"
"76db3624f1278a4f4f1e69b343bfff7bba306d47",1,"XLM-T: A Multilingual Language Model Toolkit for Twitter","This paper introduces XLMT, a framework for using and evaluating multilingual language models in Twitter, a modular framework that can easily be extended to additional tasks, as well as integrated with recent efforts also aimed at the homogenization of Twitter-specific datasets.","ArXiv",2021,"Francesco Barbieri,Luis Espinosa Anke,José Camacho-Collados",40,41,10,"https://www.semanticscholar.org/paper/76db3624f1278a4f4f1e69b343bfff7bba306d47"
"28459083ba624020c8f1c1ed7c3a075f48b4e709",1,"KLUE: Korean Language Understanding Evaluation","KLUE is a collection of 8 Korean natural language understanding tasks, including Topic Classification, Semantic Textual Similarity, Natural Language Inference, Named Entity Recognition, Relation Extraction, Dependency Parsing, Machine Reading Comprehension, and Dialogue State Tracking, and a comprehensive documentation on creating KLUE will facilitate creating similar resources for other languages in the future.","NeurIPS Datasets and Benchmarks",2021,"Sungjoon Park,Jihyung Moon,Sungdong Kim,Won Ik Cho,Jiyoon Han,Jangwon Park,Chisung Song,Junseong Kim,Yongsook Song,Tae Hwan Oh,Joohong Lee,Juhyun Oh,Sungwon Lyu,Young-kuk Jeong,I. Lee,Sang-gyu Seo,Dongjun Lee,Hyunwoo Kim,Myeonghwa Lee,Seongbo Jang,Seungwon Do,SunKyoung Kim,Kyungtae Lim,Jongwon Lee,Kyumin Park,Jamin Shin,Seonghyun Kim,Lucy Park,Alice H. Oh,Jung-Woo Ha,Kyunghyun Cho",55,164,7,"https://www.semanticscholar.org/paper/28459083ba624020c8f1c1ed7c3a075f48b4e709"
"92f2000f29f1aed7f2cc4e3cb5f783e079ef553f",1,"MergeDistill: Merging Pre-trained Language Models using Distillation","MEGEDISTILL is proposed, a framework to merge pre-trained LMs in a way that can best leverage their assets with minimal dependencies, using task-agnostic knowledge distillation and the applicability of the framework in a practical setting is demonstrated.","ArXiv",2021,"Simran Khanuja,Melvin Johnson,P. Talukdar",2,61,1,"https://www.semanticscholar.org/paper/92f2000f29f1aed7f2cc4e3cb5f783e079ef553f"
"9e8bad21221b88b516edd28fe902e591ac08efa5",1,"Modelling Latent Translations for Cross-Lingual Transfer","A new technique is proposed that integrates both steps of the traditional pipeline (translation and classification) into a single model, by treating the intermediate translations as a latent random variable, which can be fine-tuned with a variant of Minimum Risk Training.","ArXiv",2021,"E. Ponti,Julia Kreutzer,Ivan Vulic,Siva Reddy",4,55,0,"https://www.semanticscholar.org/paper/9e8bad21221b88b516edd28fe902e591ac08efa5"
"657a8a8c83339dff13892b26bb989f97b2acb182",1,"Code-switched inspired losses for spoken dialog representations","This work introduces new pretraining losses tailored to learn generic multilingual spoken dialogue representations that achieve a better performance in both monolingual and multilingual settings.","Conference on Empirical Methods in Natural Language Processing",2021,"E. Chapuis,Pierre Colombo,Matthieu Labeau,Chloe Clave",6,114,0,"https://www.semanticscholar.org/paper/657a8a8c83339dff13892b26bb989f97b2acb182"
"10a863a33c4dda778cd6a552ecbb02ac42510445",1,"On the ability of monolingual models to learn language-agnostic representations","Evidence is provided that a model can achieve language-agnostic representations even when pretrained on a single language, and it is found that monolingual models pretrained and finetuned on different languages achieve competitive performance compared to the ones that use the same target language.","ArXiv",2021,"Leandro Rodrigues de Souza,Rodrigo Nogueira,R. Lotufo",5,29,0,"https://www.semanticscholar.org/paper/10a863a33c4dda778cd6a552ecbb02ac42510445"
"8dad3a12d2a652122458dd377f62025354b17a2a",1,"Subword Mapping and Anchoring across Languages","This work proposes Subword Mapping and Anchoring across Languages (SMALA), a method to construct bilingual subword vocabularies that improves zero-shot transfer to an unseen language without task-speciﬁc data, but only by sharing subword embeddings.","Conference on Empirical Methods in Natural Language Processing",2021,"Giorgos Vernikos,Andrei Popescu-Belis",4,58,0,"https://www.semanticscholar.org/paper/8dad3a12d2a652122458dd377f62025354b17a2a"
