"id","score","title","summary","venue","year","authors","citationCount","referenceCount","influentialCitationCount","url"
"7175caf7568d46c857380d0e5b64653819d5cc45",1,"MultiLexNorm: A Shared Task on Multilingual Lexical Normalization","The MULTILEXNORM shared task provides the largest publicly available multilingual lexical normalization benchmark including 12 language variants and proposes a homogenized evaluation setup with both intrinsic and extrinsic evaluation.","Proceedings of the Seventh Workshop on Noisy User-generated Text (W-NUT 2021)",2021,"R. Goot,Alan Ramponi,A. Zubiaga,Barbara Plank,Benjamin Muller,I. Roncal,Nikola Ljubesic,Özlem Çetinoğlu,Rahmad Mahendra,Talha Çolakoglu,Timothy Baldwin,Tommaso Caselli,Wladimir Sidorenko,Bruno Kessler",13,75,0,"https://www.semanticscholar.org/paper/7175caf7568d46c857380d0e5b64653819d5cc45"
"d13a0c8d49cb268d8d245925baee0316c1fe1875",1,"Which transformer architecture fits my data? A vocabulary bottleneck in self-attention","This work empirically demonstrates the existence of an embedding rank bottleneck and its implications on the depth-to-width interplay of Transformer architectures, linking the architecture variability across domains to the often glossed-over usage of different vocabulary sizes or embedding ranks in different domains.","International Conference on Machine Learning",2021,"Noam Wies,Yoav Levine,Daniel Jannai,A. Shashua",12,52,1,"https://www.semanticscholar.org/paper/d13a0c8d49cb268d8d245925baee0316c1fe1875"
"06431546c21d7c2528aaa170c2e1078e0a82d12e",1,"Revisiting the Primacy of English in Zero-shot Cross-lingual Transfer","English is compared against other transfer languages for fine-tuning, and other high-resource languages such as German and Russian often transfer more effectively, especially when the set of target languages is diverse or unknown a priori.","ArXiv",2021,"Iulia Turc,Kenton Lee,Jacob Eisenstein,Ming-Wei Chang,Kristina Toutanova",24,33,3,"https://www.semanticscholar.org/paper/06431546c21d7c2528aaa170c2e1078e0a82d12e"
"c41819413725668fbf8e3ca1a0bcaf7fb691e582",1,"How Optimal is Greedy Decoding for Extractive Question Answering?","The results suggest that pretrained language models are so good at adapting to extractive question answering, that it is often enough to tune on a small training set for the greedy algorithm to emulate the optimal decoding strategy.","ArXiv",2021,"Or Castel,Ori Ram,Avia Efrat,Omer Levy",2,34,0,"https://www.semanticscholar.org/paper/c41819413725668fbf8e3ca1a0bcaf7fb691e582"
"89a4f4d1f8c93da85d829a1acfe8cafea2b50c00",1,"Transfer Learning for Multi-lingual Tasks - a Survey","This survey provides a comprehensive overview of the existing literature with a focus on transfer learning techniques in multilingual tasks and identifies potential opportunities for further research in this domain.","ArXiv",2021,"Amir Reza Jafari,Behnam Heidary,R. Farahbakhsh,Mostafa Salehi,M. Jalili",0,108,0,"https://www.semanticscholar.org/paper/89a4f4d1f8c93da85d829a1acfe8cafea2b50c00"
"972808b92159a782f5ca1c1ab3a8ed3867acfb2d",1,"mMARCO: A Multilingual Version of MS MARCO Passage Ranking Dataset","","ArXiv",2021,"L. Bonifacio,Israel Campiotti,R. Lotufo,Rodrigo Nogueira",18,51,4,"https://www.semanticscholar.org/paper/972808b92159a782f5ca1c1ab3a8ed3867acfb2d"
"39262814fa3e47905a2e5facf13465a1f70706b9",1,"Single-Read Reconstruction for DNA Data Storage Using Transformers","This work proposes a novel approach for single-read reconstruction using an encoder-decoder Transformer architecture for DNA based data storage and achieves lower error rates when reconstructing the original data from a single read of each DNA strand compared to state-of-the-art algorithms using 2-3 copies.","ArXiv",2021,"Yotam Nahum,Eyar Ben-Tolila,Leon Anavy",3,41,0,"https://www.semanticscholar.org/paper/39262814fa3e47905a2e5facf13465a1f70706b9"
"9d13bde760d8e77f059436d60160881becd2d2e0",1,"Predicting Ethnicity from Names with rethnicity: Methodology and Application","A new R package, rethnicity1 is provided for predicting ethnicity based on names, using the Bidirectional LSTM and Florida Voter Registration as the model and training data.","ArXiv",2021,"Fangzhou Xie",0,28,0,"https://www.semanticscholar.org/paper/9d13bde760d8e77f059436d60160881becd2d2e0"
"4318c9f87221b9f504f286540c9a6d5c1cc4e4c8",1,"Rethnicity: Predicting Ethnicity from Names","An R package, rethniicty, is provided for predicting ethnicity from names, using the Bidirectional LSTM as the model and Florida Voter Registration as training data and the availability, accuracy, and performance are compared.","",2021,"Fangzhou Xie",2,26,0,"https://www.semanticscholar.org/paper/4318c9f87221b9f504f286540c9a6d5c1cc4e4c8"
"c107835a05ca6fda6e73b64e2ed9884de4fcec0f",1,"A proposed conceptual framework for a representational approach to information retrieval","A representational approach that breaks the core text retrieval problem into a logical scoring model and a physical retrieval model that establishes connections to sentence similarity tasks in natural language processing and information access ""technologies"" prior to the dawn of computing.","SIGIR Forum",2021,"Jimmy J. Lin",21,86,1,"https://www.semanticscholar.org/paper/c107835a05ca6fda6e73b64e2ed9884de4fcec0f"
"de0e1f9980afa7949df64d53b8ae7a2f59c55579",1,"Few-shot Controllable Style Transfer for Low-Resource Settings: A Study in Indian Languages","This work pushes the state-of-the-art for few-shot style transfer with a new method modeling the stylistic difference between paraphrases, and achieves 2-3x better performance and output diversity in formality transfer and code-mixing addition across five Indian languages.","ArXiv",2021,"Kalpesh Krishna,Deepak Nathani,Xavier García,Bidisha Samanta,P. Talukdar",5,77,0,"https://www.semanticscholar.org/paper/de0e1f9980afa7949df64d53b8ae7a2f59c55579"
"7c496490abcd8d5c6e90aa3d3c82bde02680f5b0",1,"MutFormer: A context-dependent transformer-based model to predict deleterious missense mutations from protein sequences in the human genome","The introduction of MutFormer, a transformer-based model for the prediction of deleterious missense mutations that uses reference and mutated protein sequences from the human genome as the primary features, and which successfully considers sequence features that are not explored in previous studies.","",2021,"Theodore Jiang,Li Fang,Kai Wang",0,48,0,"https://www.semanticscholar.org/paper/7c496490abcd8d5c6e90aa3d3c82bde02680f5b0"
"6e2682eb2fbec93b329028b23764c1164e232c41",1,"ÚFAL at MultiLexNorm 2021: Improving Multilingual Lexical Normalization by Fine-tuning ByT5","This paper presents the winning entry to the Multilingual Lexical Normalization (MultiLexNorm) shared task at W-NUT 2021, which evaluates lexical-normalization systems on 12 social media datasets in 11 languages with the best performance by a wide margin.","WNUT",2021,"David Samuel,Milan Straka",6,35,1,"https://www.semanticscholar.org/paper/6e2682eb2fbec93b329028b23764c1164e232c41"
"9f2cf7b35224aad3a8d261e4456fe2d65a5f5d3e",1,"Large Dual Encoders Are Generalizable Retrievers","Experimental results show that the dual encoders, Generalizable T5-based dense Retrievers (GTR), outperform existing sparse and dense retrievers on the BEIR dataset (Thakur et al., 2021) significantly and is very data efficient, as it only needs 10% of MS Marco supervised data to achieve the best out-of-domain performance.","ArXiv",2021,"Jianmo Ni,Chen Qu,Jing Lu,Zhuyun Dai,Gustavo Hern'andez 'Abrego,Ji Ma,Vincent Zhao,Yi Luan,Keith B. Hall,Ming-Wei Chang,Yinfei Yang",38,32,15,"https://www.semanticscholar.org/paper/9f2cf7b35224aad3a8d261e4456fe2d65a5f5d3e"
"db3690379953f2ea4f2a015615de02e643d437ea",1,"PECO: Examining Single Sentence Label Leakage in Natural Language Inference Datasets through Progressive Evaluation of Cluster Outliers","To enable future amelio-ration efforts, introduce a novel model-driven technique, the progressive evaluation of cluster outliers (PECO) which enables both the ob-jective measurement of leakage, and the automated detection of subpopulations in the data which maximally exhibit it.","",2021,"Michael Stephen Saxon,Xinyi Wang,Wenda Xu,William Yang Wang",0,48,0,"https://www.semanticscholar.org/paper/db3690379953f2ea4f2a015615de02e643d437ea"
"5f77157038dc7f189db7e72ea58567039222d9df",1,"Examining Single Sentence Label Leakage in Natural Language Inference Datasets","This work examines how regular NLI models cheat on single sentence label leakage, and discusses how to ameliorate this.","",2022,"Michael Stephen Saxon,Xinyi Wang,Wenda Xu,William Yang Wang",0,42,0,"https://www.semanticscholar.org/paper/5f77157038dc7f189db7e72ea58567039222d9df"
"b54edea6cac055d8ff9e35c2781f5e000ebdff89",1,"Phone-ing it in: Towards Flexible Multi-Modal Language Model Training by Phonetic Representations of Data","Initial experiments using Swahili and Kinyarwanda data suggest the viability of the multi-modal approach for downstream Named Entity Recognition (NER) tasks, with models pre-trained on phone data showing an improvement of up to 6% F1-score above models that are trained from scratch.","Annual Meeting of the Association for Computational Linguistics",2022,"Colin Leong,Daniel Whitenack",0,45,0,"https://www.semanticscholar.org/paper/b54edea6cac055d8ff9e35c2781f5e000ebdff89"
"2b6b38b66fcca218cb2f381e5d4711b5c99a784f",1,"Training Text-to-Text Transformers with Privacy Guarantees","By using recent advances in JAX and XLA, this work can train models with DP that do not suffer a large drop in pre-training utility, nor in training speed, and can still be fine-tuned to high accuracies on downstream tasks (e.g. GLUE).","Findings",2022,"N. Ponomareva,Jasmijn Bastings,Sergei Vassilvitskii",4,37,0,"https://www.semanticscholar.org/paper/2b6b38b66fcca218cb2f381e5d4711b5c99a784f"
"32290d428b50f64d1cfee6ea658dc6ba977b26e9",1,"Sammaan@LT-EDI-ACL2022: Ensembled Transformers Against Homophobia and Transphobia","The approach to classify homophobia and transphobia in social media comments using an ensemble of transformer-based models to build a classifier that ranked 2nd for English, 8th for Tamil and 10th for Chennai-English.","LTEDI",2022,"I. Upadhyay,KV Aditya Srivatsa,Radhika Mamidi",2,33,0,"https://www.semanticscholar.org/paper/32290d428b50f64d1cfee6ea658dc6ba977b26e9"
"b1786a81fe804da6f2aeab0f4a8a0f60a3c4ad83",1,"A Deep Transfer Learning Method for Cross-Lingual Natural Language Inference","It is argued that the transfer learning-based loss objective is model agnostic and thus can be used with other deep learning- based architectures for cross-lingual NLI.","International Conference on Language Resources and Evaluation",2022,"Dibyanayan Bandyopadhyay,Arkadipta De,Baban Gain,Tanik Saikh,Asif Ekbal",0,24,0,"https://www.semanticscholar.org/paper/b1786a81fe804da6f2aeab0f4a8a0f60a3c4ad83"
"2005311276a1a90dc17cf6e2ca7725fee2e76e1e",1,"BasqueGLUE: A Natural Language Understanding Benchmark for Basque","BasqueGLUE is presented, the first NLU benchmark for Basque, a less-resourced language, which has been elaborated from previously existing datasets and following similar criteria to those used for the construction of GLUE and SuperGLUE.","International Conference on Language Resources and Evaluation",2022,"Gorka Urbizu,Iñaki San Vicente,X. Saralegi,Rodrigo Agerri,Aitor Soroa Etxabe",1,38,0,"https://www.semanticscholar.org/paper/2005311276a1a90dc17cf6e2ca7725fee2e76e1e"
"143659fcf93f33e9139f594cf8111c6bc85c04fa",1,"Overview of the EvaLatin 2022 Evaluation Campaign","This paper describes the organization and the results of the second edition of EvaLatin, the campaign for the evaluation of Natural Language Processing tools for Latin, and the three shared tasks proposed in EvaLatin 2022, i.","LT4HALA",2022,"R. Sprugnoli,Marco Passarotti,F. M. Cecchini,Margherita Fantoli,Giovanni Moretti",3,14,1,"https://www.semanticscholar.org/paper/143659fcf93f33e9139f594cf8111c6bc85c04fa"
"6102fe88a512290b80e83ed2fe17606b166e505a",1,"Transformer-based Part-of-Speech Tagging and Lemmatization for Latin","The paper features a thorough discussion of part-of-speech and lemmatization errors which shows how the system performance may be improved for Classical, Medieval and Neo-Latin texts.","LT4HALA",2022,"Krzysztof Wróbel,Krzysztof Nowak",1,12,0,"https://www.semanticscholar.org/paper/6102fe88a512290b80e83ed2fe17606b166e505a"
"0ffb0b109acddf0067aec252221e0ea04d317ddc",1,"A Framework for Sexism Detection on Social Media via ByT5 and TabNet","A combination of byte-level model ByT5 with tabular modeling via TabNet that has at its core an ability to take into account platform and language aspects of the challenging task of sexism detection is proposed.","IberLEF@SEPLN",2022,"A. Younus,M. A. Qureshi",0,16,0,"https://www.semanticscholar.org/paper/0ffb0b109acddf0067aec252221e0ea04d317ddc"
"9758782feed4b4b9bf0ec18b802462e8023a7f83",1,"AfriTeVA: Extending ?Small Data? Pretraining Approaches to Sequence-to-Sequence Models","","Workshop on Deep Learning Approaches for Low-Resource Natural Language Processing",2022,"Odunayo Jude Ogundepo,Akintunde Oladipo,Mofetoluwa Adeyemi,Kelechi Ogueji and Jimmy Lin",2,33,0,"https://www.semanticscholar.org/paper/9758782feed4b4b9bf0ec18b802462e8023a7f83"
"5905e8146099d8b69ab4f51c2f1e2a54eb65d3e9",1,"On the Influence of Tokenizers in NLP Pipelines","This thesis examines the influence of tokenization in NLP pipelines, by analyzing, reproducing, and quantifying claims from the token-free NLP literature, using the example of NER, and concludes that token- free models, like ByT5, offer significant advantages over their tokenizer-based alternatives.","",2022,"",0,49,0,"https://www.semanticscholar.org/paper/5905e8146099d8b69ab4f51c2f1e2a54eb65d3e9"
"7072db6eddb85ecd2c117365d91bd694760f726e",1,"Position Information in Transformers: An Overview","An overview and theoretical comparison of existing methods to incorporate position information into Transformer models is provided and what characteristics of an application should be taken into account when selecting a position encoding is indicated.","Computational Linguistics",2021,"Philipp Dufter,Martin Schmitt,Hinrich Schütze",32,67,2,"https://www.semanticscholar.org/paper/7072db6eddb85ecd2c117365d91bd694760f726e"
"a70fc86508bd0133d5d984a4e777abef1934d76c",1,"BARTpho: Pre-trained Sequence-to-Sequence Models for Vietnamese","BARTpho uses the “large” architecture and the pre-training scheme of the sequence-to-sequence denoising autoencoder BART, thus it is especially suitable for generative NLP tasks and is found to be more effective than mBART on these two tasks.","Interspeech",2021,"Nguyen Luong Tran,Duong Minh Le,Dat Quoc Nguyen",4,46,1,"https://www.semanticscholar.org/paper/a70fc86508bd0133d5d984a4e777abef1934d76c"
"e35357ac461a669fe7e4b877ee1fad0dfda26303",1,"Few-shot Controllable Style Transfer for Low-Resource Multilingual Settings","This work pushes the state-of-the-art for few-shot style transfer with a new method modeling the stylistic difference between paraphrases, and achieves 2-3x better performance in formality transfer and code-mixing addition across seven languages.","Annual Meeting of the Association for Computational Linguistics",2021,"Kalpesh Krishna,Deepak Nathani,Xavier García,Bidisha Samanta,P. Talukdar",5,85,0,"https://www.semanticscholar.org/paper/e35357ac461a669fe7e4b877ee1fad0dfda26303"
"66d735987a31d666a6459566ae026c40ab9a1c3a",1,"The Efficiency Misnomer","It is demonstrated how incomplete reporting of cost indicators can lead to partial conclusions and a blurred or incomplete picture of the practical considerations of different models, and suggestions to improve reporting of efficiency metrics are presented.","International Conference on Learning Representations",2021,"M. Dehghani,Anurag Arnab,L. Beyer,Ashish Vaswani,Yi Tay",34,87,3,"https://www.semanticscholar.org/paper/66d735987a31d666a6459566ae026c40ab9a1c3a"
"e53f455b3300d95738dac117419c88fbde58ac4e",1,"Chemical identification and indexing in PubMed full-text articles using deep learning and heuristics","This manuscript describes a three-stage pipeline that individually performs chemical mention detection, entity normalization and indexing in PubMed full-text articles and proposes rules for identifying the more relevant MeSH codes for each article.","Database J. Biol. Databases Curation",2022,"Tiago Almeida,Rui Antunes,João F Silva,João Rafael Almeida,Sérgio Matos",0,141,0,"https://www.semanticscholar.org/paper/e53f455b3300d95738dac117419c88fbde58ac4e"
"f357b35e068bbfbb8468b48198ab63241713629d",1,"Correcting diacritics and typos with ByT5 transformer model","This work tackles diacritics restoration and typos correction at once by employing the newly-developed universal ByT5 byte-level seq2seq transformer model that requires no language-specific model structures and strongly outperforms classical spell-checking or dictionary-based approaches.","Applied Sciences",2022,"Lukas Stankevicius,M. Lukoševičius,J. Kapočiūtė-Dzikienė,Monika Briediene,Tomas Krilavičius",4,138,1,"https://www.semanticscholar.org/paper/f357b35e068bbfbb8468b48198ab63241713629d"
"8f2bca9d684005675e294b33c26481e36f528cdb",1,"data2vec: A General Framework for Self-supervised Learning in Speech, Vision and Language","Data2vec is a framework that uses the same learning method for either speech, NLP or computer vision to predict latent representations of the full input data based on a masked view of the input in a self-distillation setup using a standard Transformer architecture.","International Conference on Machine Learning",2022,"Alexei Baevski,Wei-Ning Hsu,Qiantong Xu,Arun Babu,Jiatao Gu,Michael Auli",202,87,42,"https://www.semanticscholar.org/paper/8f2bca9d684005675e294b33c26481e36f528cdb"
"7016eb4f34611f97fe8c99176246e314678e03f4",1,"A New Generation of Perspective API: Efficient Multilingual Character-level Transformers","This paper presents the fundamentals behind the next version of the Perspective API from Google Jigsaw, and presents a single multilingual token-free Charformer model that is applicable across a range of languages, domains, and tasks.","Knowledge Discovery and Data Mining",2022,"Alyssa Lees,V. Tran,Yi Tay,Jeffrey Scott Sorensen,Jai Gupta,Donald Metzler,Lucy Vasserman",6,37,2,"https://www.semanticscholar.org/paper/7016eb4f34611f97fe8c99176246e314678e03f4"
"8a4eec70e3d0c43abf26757252ad6210c9717f6c",1,"Towards Lithuanian grammatical error correction","This work constructs a grammatical error correction model for Lithuanian, the language rich in archaic features, by employing the recent advances in transformer architectures and shares the best trained model, achieving F0.5 = 0.92.","",2022,"Lukas Stankevivcius,Mantas Lukovsevivcius",0,32,0,"https://www.semanticscholar.org/paper/8a4eec70e3d0c43abf26757252ad6210c9717f6c"
"a747e8f2659df479c0092301b9658fc582423df1",1,"One Country, 700+ Languages: NLP Challenges for Underrepresented Languages and Dialects in Indonesia","An overview of the current state of NLP research for Indonesia's 700+ languages is provided and general recommendations are provided to help develop NLP technology not only for languages of Indonesia but also other underrepresented languages.","Annual Meeting of the Association for Computational Linguistics",2022,"Alham Fikri Aji,Genta Indra Winata,Fajri Koto,Samuel Cahyawijaya,A. Romadhony,Rahmad Mahendra,Kemal Kurniawan,David Moeljadi,Radityo Eko Prasojo,Timothy Baldwin,Jey Han Lau,Sebastian Ruder",5,204,0,"https://www.semanticscholar.org/paper/a747e8f2659df479c0092301b9658fc582423df1"
"1ed66e048bb025e75aa5ea660545285212e5341f",1,"Scaling Up Models and Data with t5x and seqio","Two software libraries are presented: t5x simplifies the process of building and training large language models at scale while maintaining ease of use, and seqio provides a task-based API for simple creation of fast and reproducible training data and evaluation pipelines.","ArXiv",2022,"Adam Roberts,Hyung Won Chung,Anselm Levskaya,Gaurav Mishra,James Bradbury,D. Andor,Sharan Narang,Brian Lester,Colin Gaffney,Afroz Mohiuddin,Curtis Hawthorne,Aitor Lewkowycz,Alexandru Salcianu,Marc van Zee,Jacob Austin,Sebastian Goodman,Livio Baldini Soares,Haitang Hu,Sasha Tsvyashchenko,Aakanksha Chowdhery,Jasmijn Bastings,Jannis Bulian,Xavier García,Jianmo Ni,A. Chen,Kathleen Kenealy,J. Clark,Stephan Lee,Daniel H Garrette,J. Lee-Thorp,Colin Raffel,Noam M. Shazeer,Marvin Ritter,Maarten Bosma,Alexandre Passos,Jeremy B. Maitin-Shepard,Noah Fiedel,Mark Omernick,Brennan Saeta,Ryan Sepassi,A. Spiridonov,Joshua Newlan,Andrea Gesmundo",37,23,5,"https://www.semanticscholar.org/paper/1ed66e048bb025e75aa5ea660545285212e5341f"
"094ff971d6a8b8ff870946c9b3ce5aa173617bfb",1,"PaLM: Scaling Language Modeling with Pathways","A 540-billion parameter, densely activated, Transformer language model, which is called PaLM achieves breakthrough performance, outperforming the state-of-the-art on a suite of multi-step reasoning tasks, and outperforming average human performance on the recently released BIG-bench benchmark.","ArXiv",2022,"Aakanksha Chowdhery,Sharan Narang,Jacob Devlin,Maarten Bosma,Gaurav Mishra,Adam Roberts,P. Barham,Hyung Won Chung,Charles Sutton,Sebastian Gehrmann,Parker Schuh,Kensen Shi,Sasha Tsvyashchenko,Joshua Maynez,Abhishek Rao,Parker Barnes,Yi Tay,Noam M. Shazeer,Vinodkumar Prabhakaran,Emily Reif,Nan Du,B. Hutchinson,Reiner Pope,James Bradbury,Jacob Austin,M. Isard,Guy Gur-Ari,Pengcheng Yin,Toju Duke,Anselm Levskaya,S. Ghemawat,Sunipa Dev,H. Michalewski,Xavier García,Vedant Misra,Kevin Robinson,L. Fedus,Denny Zhou,Daphne Ippolito,D. Luan,Hyeontaek Lim,Barret Zoph,A. Spiridonov,Ryan Sepassi,David Dohan,Shivani Agrawal,Mark Omernick,Andrew M. Dai,T. S. Pillai,Marie Pellat,Aitor Lewkowycz,Erica Moreira,Rewon Child,Oleksandr Polozov,Katherine Lee,Zongwei Zhou,Xuezhi Wang,Brennan Saeta,Mark Díaz,Orhan Firat,Michele Catasta,Jason Wei,K. Meier-Hellstern,D. Eck,J. Dean,Slav Petrov,Noah Fiedel",471,173,68,"https://www.semanticscholar.org/paper/094ff971d6a8b8ff870946c9b3ce5aa173617bfb"
"880c8973ea1376c6bff23226b3f64792657aa666",1,"ByT5 model for massively multilingual grapheme-to-phoneme conversion","It is found that ByT5 operating on byte-level inputs signiﬁcantly outperformed the token-based mT5 model in terms of multilingual G2P, and pairwise comparison with monolingual models in these languages suggests that multilingual ByT 5 models generally lower the phone error rate by jointly learning from a variety of languages.","Interspeech",2022,"Jian Zhu,Cong Zhang,David Jurgens",1,34,0,"https://www.semanticscholar.org/paper/880c8973ea1376c6bff23226b3f64792657aa666"
"e37018d3cfab9cfc29a7b78404e6c86ea18a907e",1,"GPT-NeoX-20B: An Open-Source Autoregressive Language Model","GPT-NeoX-20B is introduced, a 20 billion parameter autoregressive language model trained on the Pile, whose weights will be made freely and openly available to the public through a permissive license.","BIGSCIENCE",2022,"Sid Black,Stella Rose Biderman,Eric Hallahan,Quentin G. Anthony,Leo Gao,Laurence Golding,Horace He,Connor Leahy,Kyle McDonell,Jason Phang,M. Pieler,Usvsn Sai Prashanth,Shivanshu Purohit,Laria Reynolds,J. Tow,Benqi Wang,Samuel Weinbach",66,141,9,"https://www.semanticscholar.org/paper/e37018d3cfab9cfc29a7b78404e6c86ea18a907e"
"0b9e130c6305de7766697ba7655f56010aaffd61",1,"A Hierarchical N-Gram Framework for Zero-Shot Link Prediction","A Hierarchical N -gram framework for Z ero-S hot L ink P rediction (HNZSLP) that lever-ages character n-gram information for ZSLP and achieves state-of-the-art performance on two standard Z SLP datasets.","ArXiv",2022,"Mingchen Li,Junfan Chen,Samuel Mensah,Nikolaos Aletras,Xiulong Yang,Yang Ye",0,24,0,"https://www.semanticscholar.org/paper/0b9e130c6305de7766697ba7655f56010aaffd61"
"cb16b85891172572cd856142880b503db0c2bc61",1,"What Makes Instruction Learning Hard? An Investigation and a New Challenge in a Synthetic Environment","This work uses the task of deciding whether a given string matches a regular expression to identify properties of tasks, instructions, and instances that make instruction learning challenging, and proposes Hard RegSet as a challenging instruction learning task and a controlled environment for studying instruction learning.","ArXiv",2022,"Matthew Finlayson,Kyle Richardson,Ashish Sabharwal,Peter Clark",4,31,1,"https://www.semanticscholar.org/paper/cb16b85891172572cd856142880b503db0c2bc61"
"7267812178393b8ae0b99648f02661ca1ff2b412",1,"Bilingual End-to-End ASR with Byte-Level Subwords","This paper investigates how the output representation of an end-to-end neural network affects multilingual automatic speech recognition (ASR), and finds that BBPE with penalty schemes can improve utterance-based bilingual ASR performance by 2% to 5% relative even with smaller number of outputs and fewer parameters.","IEEE International Conference on Acoustics, Speech, and Signal Processing",2022,"Liuhui Deng,Roger Hsiao,Arnab Ghoshal",1,18,0,"https://www.semanticscholar.org/paper/7267812178393b8ae0b99648f02661ca1ff2b412"
